docno	text_region_id	text	Docno	Page	x1	y1	x2	y2
1036	-1	"A2_117-tg-3-phenylchromacetal Pe"" PR /topspin tgraham 117 r [- i L Q OEt F990 -500 +450 -400 +350 - 300 +250 +200 150 t+ 100 -50 I . JL \ h 0 aibpit Vi TT HT 1 eCcOoOatTnm O oo m | NAonan p an T an MtOON oO mr oO N [ t T r T t T t T r T T T t T T T T T t T r T T t T r T t T t T r T t T t T r T t 1 5 10.0 9.5 9.0 8.5 8.0 7.5 7.0 6.5 6.0 5.5 4.5 4.0 3.5 3.0 2.5 2.0 1.5 1.0 0.5 0.0 -0.5 5.0 f1 (ppm)"	Paper5_SI	128	58	54	3311	2417
1037	-1	-4500 A2_117-tg-3-phenylchromacetal/1 ile ty © C1 . topspindgrahagiel £7 as 12796 121.88 121.79 121.66 116.48 96.99 \125.57 63.77 | ~127.52 | SS --4000 | oa OEt - 3500 3000 t 2500 in +2000 - 1500 [1000 -500 ! L500 ---1000 ---1500 ---2000 ---2500 [ t T t T t T t T t T T T r T r T r T r T r T r T r T t T t T t T t T t T t T t 1 0 190 180 170 160 150 140 130 120 110 #109 ; 90 80 70 60 50 40 30 20 10 0 ppm	Paper5_SI	129	58	63	3346	2419
1038	-1	15.40	Paper5_SI	129	2958	103	2990	214
1039	-1	-- 1000 A1_36-ML-1-7 ea Cl --900 Q O€t --800 -- 700 --600 -500 --400 -- 300 --200 --100 F8t't F8t't F-90'T E90'T 7.0 2.0 1.5 1.0 0.5 0.0 -0.5 2.5 3.0 3.5 4.0 5.5 5.0 4.5 f1 (ppm) 6.0 6.5 9.5 9.0 8.5 8.0 7.5 10.0 5	Paper5_SI	130	58	69	3330	2417
1040	-1	A2_76-tg-chloroacetal +4000 C13APT.PU CDCI3 /opt/topspin tgraham 7@& 129.12 126.67 126.33 122.16 121.30 118.07 95.01 63.95 3500 —15805 “125.73 f ‘ Cl = +3000 O OEt +2500 +2000 +1500 [1000 | +500 | --500 [--1000 ---1500 ---2000 | +-2500 Lf +--3000 T t T t T r T t T t T r T r T t T t T r T t T t T r T t T t T t T r T t T t T r T t T t T t T r T 230 220 210 #200 #190 180 170 4160 #4150 140 130 = =#© 120 1 122 ; 100 90 80 70 60 50 40 30 20 10 0 -10 ppm	Paper5_SI	131	59	59	3346	2419
1041	-1	15.38	Paper5_SI	131	2826	103	2858	214
1042	-1	Lee, Gray, Paek, and Burke Simple, Efficient, and Modular Syntheses of Polyene Natural Products via Iterative Cross-Coupling Suk Joong Lee, Kaitlyn C. Gray, James S. Paek, and Martin D. Burke’ Contribution from the Roger Adams Laboratory Department of Chemistry, University of Illinois at Urbana-Champaign, Urbana, IL, 61801 SUPPORTING INFORMATION Part A I. General Methods S1-S2 Il. Synthesis BB,—BB, and selective cross-coupling reactions (Schemes 1-3) S3-S16 III. Total synthesis of all-trans-retinal (23) (Scheme 4) $17-S20 IV. Total synthesis of B-parinaric acid (27) (Scheme 5) $21-S26 V. Synthesis of 1/2 of the amphotericin B macrolide (31) (Scheme 6) $27-S38 Part B VI. NMR Spectra Part C VII. X-ray data for BB, and 14 (cif files) I. General Methods Materials. Pd(PPh,), was a generous gift from Sigma-Aldrich. Commercial reagents were purchased from Sigma-Aldrich, Strem, Fisher Scientific, Alfa Aesar, or Lancaster Synthesis and were used without further purification unless otherwise noted. Solvents were purified via passage through packed columns as described by Pangborn and coworkers’ (THF, Et,O, CH,CN, CH,CL: dry neutral alumina; hexane, benzene, and toluene: dry neutral alumina and Q5 reactant; DMSO, DMF: activated molecular sieves). Triethylamine and 2,6-lutidine were freshly distilled under an atmosphere of nitrogen from CaH,. The following compounds were prepared according to _ literature precedent: (£)-(2- bromoethenyl)dibromoborane (3)°, (£)-1-chloro-2-iodoethylene (17)°*, (1E,3E)-2-methyl-4-(2,6,6- trimethylcyclohex-1-enyl)buta-1,3-dienylboronic acid (20)*, (E)-3-bromobut-2-enal (22), (E)-2- (tributylstannyl)vinylzinc chloride (15)°, (£)-methyl 10-iododec-9-enoate (35)’, diol 37)’, dichlomethylpinacolboronic ester (42) ”. ' Pangborn, A. B.; Giardello, M. A.; Grubbs, R. H.; Rosen, R. K.; Timmers, F. J. Organometallics 1996, 15, 1518-1520. Sl	Paper9_SIa	1	210	161	2339	3130
1043	-1	2 Hyuga, S.; Chiba, Y.; Yamashina, N.; Hara, S.; Suzuki, A. Chem. Lett. 1987, 1757-1760.	Paper9_SIa	1	211	2535	1715	2578
1044	-1	3 (a) Negishi, E. I.; Okukado, N.; Lovich, S. F.; Luo, F. T. J. Org. Chem. 1984, 49, 2629-2632. (b) Organ, M. G.; Ghasemi, H. J. Org. Chem. 2004, 69, 695-700.	Paper9_SIa	1	210	2583	2309	2673
1045	-1	* Uenishi, J.; Matsui, K.; Wada, A.; Tetrahedron Lett. 2003, 44, 3093-3096.	Paper9_SIa	1	210	2679	1471	2719
1046	-1	> Romo, D.; Rzasa, R.M.; Shea, H.A.; Park, K.; Langenhan, J.M.; Sun, L.; Akhiezer, A.; Liu, J.O. J. Am. Chem. Soc. 1998, 120, 12237-12254	Paper9_SIa	1	211	2727	2255	2814
1047	-1	® Pihko, P.M.; Koskinen, A.MLP. Synlett 1999, 12, 1966-1968.	Paper9_SIa	1	211	2823	1245	2865
1048	-1	7 Zhang, W.; Sun, M.; Salomon, R.G. J. Org. Chem. 2006, 77, 5607.	Paper9_SIa	1	211	2872	1348	2915
1049	-1	5 Paterson, I.; Florence, G.J.; Gerlach, K.; Scott, J.P.; Sereining, N. J. Am. Chem. Soc. 2001, 123, 9525-9544.	Paper9_SIa	1	211	2920	2025	2963
1050	-1	° (a) Wuts, P.G.M.; Thompson, P.A. J. Organomet. Chem. 1982, 234, 137-141. (b) Raheem, I.T.; Goodman, S.N.; Jacobsen, E.N. J. Am. Chem. Soc. 2004, 126, 706-707.	Paper9_SIa	1	211	2968	2280	3055
1051	-1	Lee, Gray, Paek, and Burke General Experimental Procedures. All palladium-mediated cross-coupling reactions were set up in a glove box and performed under an atmosphere of argon or nitrogen in oven- or flame-dried I-Chem or Wheaton vials sealed with PTFE-lined plastic caps unless otherwise indicated. All other reactions were performed in oven- or flame-dried round-bottom or modified Schlenk flasks fitted with rubber septa under a positive pressure of argon or nitrogen unless otherwise indicated. Organic solutions were concentrated via rotary evaporation under reduced pressure. Reactions were monitored by analytical thin layer chromatography (TLC) performed using the indicated solvent on E. Merck silica gel 60 F254 plates (0.25 mm). Compounds were visualized by exposure to a UV lamp (A = 254 and 365 nm), a solution of KMnO,, a solution of ceric ammonium molybdate (CAM), or an acidic solution of p-anisaldehyde followed by brief heating using a Varitemp heat gun. Flash column chromatography was performed as described by Still and coworkers’? using EM Merck silica gel 60 (230-400 mesh) and/or Aldrich Florisil® (an activated magnesium silicate: 100-200 mesh). Structural Analysis. 'H NMR spectra were recorded at 23 °C on one of the following instruments: Varian Unity 400, Varian Unity 500, Varian Unity Inova 5OONB. Chemical shifts (6) are reported in parts per million (ppm) downfield from tetramethylsilane and referenced to residual protium in the NMR solvent (CDCl,, 6 = 7.26; CD,CN, 5 = 1.93; (CD,),CO, 6 = 2.04; DMSO-d,, 5 = 2.49, center line). Data are reported as follows: chemical shift, multiplicity (s = singlet, d = doublet, t = triplet, q = quartet, qn = quintet, sext = sextet, dd = doublet of doublets, dt = doublet of triplets, ddt = doublet of doublet of triplets, dtd = doublet of triplet of doublets, m = multiplet, br = broad), coupling constant (J) in Hertz (Hz), and integration. Based on 'H NMR analysis, unless otherwise indicated the isomeric purity of all olefin- containing compounds was judged to be >95:5 E:Z ('H and '°C NMR spectra of all compounds are provided in SI.B). MIDA boronates were judged to be stable to long-term storage based on the observation of no change 'H NMR spectra after the indicated time. ('H NMR spectra of BB, and 14 collected both before and after storage on the benchtop under air for 1 year and 5 months are included in SI.B). °C NMR spectra were recorded at 23 °C on one of the following instruments: Varian Unity 400, Varian Unity 500 or Varian Unity Inova 500. Chemical shifts (6) are reported in ppm downfield from tetramethylsilane and referenced to carbon resonances in the NMR solvent (CDCL, 6 = 77.0; CD,CN, 6 = 1.30; (CD,;),CO, 5 = 29.8; DMSO-d,, 5 = 39.5, center line). Carbons bearing boron substituents were not reported (quadrupolar relaxation). ''B NMR were recorded using a General Electric GN300WB instrument and referenced to an external standard of (BF,*Et,O). High resolution mass spectra (HRMS) were performed by Furong Sun and Dr. Steve Mullen at the University of Illinois School of Chemical Sciences Mass Spectrometry Laboratory. Infrared spectra were collected from a thin film on NaCl plates or as a KBr pellet on a Mattson Galaxy Series FTIR 5000 spectrometer with internal referencing. Absorption maxima (V,,,.) are reported in wavenumbers (cm). X-ray crystallographic analyses of BB, and 14 were carried out by Dr. Scott Wilson at the University of Illinois George L. Clark X-Ray facility. '° Still, W.C.; Kahn, M.; Mitra, A.; J. Org. Chem. 1978, 43, 2923-2925. S2	Paper9_SIa	2	210	161	2340	3130
1052	-1	"Lee, Gray, Paek, and Burke II. Synthesis of BB,—BB, and selective cross-coupling reactions BBr3 Bra SX BBr2 0 to 23 °C 24 h, 55% o (E)-(2-bromoethenyl)dibromoborane (3)’ Bra X&~ BBr> 3 'H NMR (500 MHz, CDCI) 5 7.97 (d, J = 15.0 Hz, 1H), 7.08 (d, J = 15.0 Hz, 1H) Me N C > MeN Ber HO.C COH f oo Bra NS? 2 Br~ S“""‘9~No 3 2,6-Lutidine BB, DMSO, 0 to 23 °C 48 h, 60% (E£)-(2-bromoethenyl)boronate ester (BB,) 83"	Paper9_SIa	3	211	161	2339	3130
1053	-1	In a subdued light environment, an oven-dried 100 mL one-neck round bottom flask equipped with a magnetic stir bar and a rubber septum was flushed with acetylene gas three-times using a five-inch balloon attached to a needle. The flask was attached to three balloons filled with acetylene gas and cooled to 0 °C. To the flask at 0 °C was added boron tribromide (75.0 g, 299.4 mmol) dropwise via syringe over 15 min with stirring. The reaction mixture was allowed to warm to 23 °C and then stirred at 23 °C for 24 hr. (Each balloon was refilled with acetylene gas after the acetylene gas in the balloon was consumed; if a needle became clogged during the reaction mixture it was replaced with a new one). The resulting dark- blue crude mixture was distilled three-times under high vacuum connected with two dry ice/acetone traps to provide 3 (45.20 g, 163.4 mmol) as a colorless oil in 55 % yield. (bp = 50-55 °C/13 mmHg). (The fractional vacuum distillation was carried out at 23 °C for 30 minutes before heating to remove a small amount of residual boron tribromide and then the crude mixture was slowly heated to around 65 °C using an oil-bath until distillation was completed. The oil-bath temperature was carefully maintained below 70 °C to inhibit a polymerization reaction). The triply distilled title compound 3 was used immediately in the next reaction. This reaction was conducted in a subdued light environment in an oven-dried 500 mL three-neck round bottom flask equipped with a magnetic stir bar. To a stirred mixture of N-methyliminodiacetic acid (MIDA, 2) (16.93 g, 113.9 mmol, 1.50 eq.) and 2,6-lutidine (17.69 mL, 151.86 mmol, 2.0 eq.) in DMSO (250 mL) at 0 °C under nitrogen was added freshly distilled 3 (21.00 g, 75.93 mmol) dropwise via syringe over 15 min. The reaction mixture was allowed to warm to 23 °C and then stirred at 23 °C for 48 h. The resulting yellow mixture was treated with water (300 mL) and extracted with THF:diethyl ether 1:1 (3 x	Paper9_SIa	3	203	892	2348	3044
1054	-1	Lee, Gray, Paek, and Burke 500 mL). The combined organic phases were washed with brine (3 x 350 mL), dried over anhydrous magnesium sulfate, and concentrated in vacuo to provide a light yellow solid. The crude product was purified by flash chromatography on silica gel (EtOAc:petroleum ether 1:1 — EtOAc — EtOAc:MeCN 9:1) to give the title compound BB, as a colorless crystalline solid (11.98 g, 45.75 mmol, 60%). Crystals suitable for X-ray crystallography analysis were grown by slow evaporation from ethyl acetate at 23 °C. This material was stored under air at 23 °C for one year and six months without decomposition. TLC (EtOAc) R; = 0.46, visualized with KMnO,. 'H NMR (500 MHz, CD,CN) 5 6.69 (d, J = 15.0 Hz, 1H), 6.33 (d, J = 14.5 Hz, 1H), 3.97 (d, J = 17.0 Hz, 2H), 3.82 (d, J= 17.0 Hz, 2H), 2.80 (s, 3H). 3C NMR (125 MHz, CD,CN) 5 169.0, 118.8, 62.6, 47.9. ''B NMR (100 MHz, CD,CN) 6 10.5. IR (thin film, cm'') 3006, 2962, 1755, 1589, 1451, 1338, 1286, 1196, 1152, 1118, 1080, 1025, 1009, 961, 893, 872, 773, 678. S4	Paper9_SIa	4	210	161	2339	3130
1055	-1	HRMS (ESI) Calculated for C;H,,.NO,BrB (M+H)’: 261.9886 Found: 261.9874	Paper9_SIa	4	211	1928	1447	2092
1056	-1	Lee, Gray, Paek, and Burke MeN Ph BOH)2 MeN ~~ B-0\S0 4 A Broo BB, O pcy, Pa(OAc)2 6 Meo ome KF, PhMe 23°C, 24h 5a 92% (E,E)-1,3-butadienyl-(4-phenyl)boronate ester (6) MeN Foe PhS BRK 6 TLC (EtOAc) R, = 0.85, visualized by UV lamp (A = 254 nm) or with KMnQ,. 'H NMR (500 MHz, DMSO-d,) 5 7.48 (d, J = 7.5 Hz, 2H), 7.33 (t, J = 7.5 Hz, 2H), 7.24 (t, J = 7.5 Hz, 1H), 6.93 (dd, J = 15.5, 10.5 Hz, 1H), 6.65 (d, J = 15.5 Hz, 1H), 6.63 (dd, J = 17.0, 10.5 Hz, 1H), 5.78 (d, J = 17.5 Hz, 1H), 4.24 (d, J = 17.5 Hz, 2H), 4.03 (d, J = 17.0 Hz, 2H), 2.78 (s, 3H). 3C NMR (125 MHz, DMSO-d,) 5 169.3, 142.0, 136.9, 132.9, 130.9, 128.7, 127.8, 126.5, 61.4, 46.8. ''B NMR (100 MHz, DMSO-d,) 6 11.4. S5	Paper9_SIa	5	211	161	2339	3130
1057	-1	A solution of the catalyst was prepared as follows: A 20 mL Wheaton vial equipped with a magnetic stir bar was charged with Pd(OAc), (5.60 mg, 0.025 mmol, 1.0 eq.) and 2-dicyclohexylphosphino-2’,6’- dimethoxy-1,1’-biphenyl (5a) (20.5 mg, 0.050 mmol, 2.0 eq.). Toluene (3.00 mL) was added and the vial was sealed with a PTFE-lined plastic cap. The resulting mixture was stirred at 23 °C for 45 min. resulting in a yellow Pd/Sa catalyst solution (0.00833 N Pd in toluene). HRMS (ESI) Calculated for C,;H,,NO,B (M+H)’: 286.1251 Found: 286.1249	Paper9_SIa	5	209	888	2339	3024
1058	-1	This catalyst solution was then utilized in the following procedure: A 30 mL Wheaton vial equipped with a magnetic stir bar was charged with BB, (0.262 g, 1.00 mmol, 1.0 eq.), trans-2-phenylvinylboronic acid (4) (0.229 g, 1.50 mmol, 1.5 eq.), KF (0.116 g, 2.00 mmol, 2.0 eq.; based on BB,), toluene (7.0 mL), and the catalyst solution (1.20 mL, 0.01 mmol, 1.0 mol% Pd). The vial was then sealed with a PTFE-lined plastic cap, and the reaction mixture was stirred for 24 hr at 23 °C. The resulting heterogeneous yellow mixture was diluted with acetonitrile (10.0 mL), filtered through short pad Celite using acetonitrile (100 mL), and concentrated in vacuo. The crude product was purified by flash chromatography on silica gel (EtOAc:Petroleum ether 1:1 —> EtOAc — EtOAc:MeCN 2:1) to give the title compound 6 as a colorless crystalline solid (0.263 g, 0.922 mmol, 92%). Dienyl boronate 6 was stable to storage for at least two weeks on the benchtop under air both as a solid and as a solution in DMSO-d,.	Paper9_SIa	5	210	1176	2339	1743
1059	-1	Lee, Gray, Paek, and Burke IR (thin film, cm'') 2967, 1741, 1698, 1682, 1651, 1556, 1446, 1338, 1309, 1258, 1113, 1082, 1013, 950, 885, 865, 750, 694, 654. S6	Paper9_SIa	6	211	161	2339	3130
1060	-1	Lee, Gray, Paek, and Burke MeN 7 ~SnBug MeN 7 ¢ Br O° *O Pda dbag, FursP STS 07S0 BB, DMF, 45 °C 8 12h, 91% (E,E)-1,3-butadienyl-boronate ester (8) MeN TLC (EtOAc) R; = 0.46, visualized with KMnO,. 'H NMR (500 MHz, CD,CN) 5 6.56 (dd, J = 17.5, 10.5 Hz, 1H), 6.43 (dtd, J = 17.0, 10.0, 0.5 Hz, 1H), 5.66 (dd, J = 17.5, 0.5 Hz, 1H), 5.28 (ddt, J = 17.0, 2.0, 0.5 Hz, 1H), 5.14 (ddt, J = 10.0, 2.0, 0.5 Hz, 1H), 3.96 (d, J = 17.0 Hz, 2H), 3.79 (d, J = 17.0 Hz, 2H), 2.76 (s, 3H). 3C NMR (125 MHz, CD,CN) 5 169.5, 144.3, 140.1, 119.0, 62.3, 47.6. ''B NMR (100 MHz, CD,CN) 6 10.9. IR (thin film, cm'') 3006, 2960, 1770, 1710, 1636, 1592, 1460, 1424, 1338, 1286, 1194, 1154, 1125, 1088, 1024, 958, 893, 874, 837, 719, 648. S7	Paper9_SIa	7	211	161	2339	3130
1061	-1	A 30 mL Wheaton vial equipped with a magnetic stir bar was charged with BB, (0.262 g, 1.00 mmol, 1.0 eq.), Pd,dba, (0.037 g, 0.040 mmol, 4.0 mol% Pd), Fur;P (0.021 g, 0.090 mmol, 9.0 mol%), DMF (8.0 mL) and tributyl(vinyltin (7) (0.346 mL, 1.15 mmol, 1.15 eq.). The vial was then sealed with a PTFE- lined plastic cap, and the reaction mixture was stirred for 12 h at 45 °C. The resulting reddish mixture was diluted with brine (50 mL) and then extracted with ethyl acetate (3 x 100 mL). The combined organic fractions were dried over anhydrous magnesium sulfate and concentrated in vacuo. The crude product was purified by flash chromatography on silica gel (EtOAc:Petroleum ether 1:1 — EtOAc — EtOAc:MeCN 15:1) to give the title compound 8 as a colorless crystalline solid (0.190 g, 0.909 mmol, 91%). Loo HRMS (ESI) Calculated for C,H,,BNO,Na (M+Na)*: 232.0757 Found 232.0757	Paper9_SIa	7	210	866	2339	2642
1062	-1	nN ‘Oo O 8	Paper9_SIa	7	1018	1478	1454	1598
1063	-1	"Lee, Gray, Paek, and Burke O MeN MeO B-o\o YS S070 90 B-O Bro ""9"" Pd(OAc)o, PPh, BB, Et,N, DMF, 45 °C 12h, 90% y (E,E)-1,3-butadienyl-(4-methylester)boronate ester (10) A 30 mL Wheaton vial equipped with a magnetic stir bar was charged with BB, (0.262 g, 1.00 mmol, 1.0 eq.), PPh, (0.0159 g, 0.060 mmol, 6.0 mol%), Pd(OAc), (0.0067 g, 0.030 mmol, 3.0 mol% Pd), Et,N (0.279 mL, 2.00 mmol, 2.0 eq.; based on BB,), methyl acrylate (9) (0.136 mL, 1.50 mmol, 1.5 eq.), and DMF (7.0 mL). The vial was sealed with a PTFE-lined plastic cap, and the reaction mixture was stirred at 45 °C for 12 h. The resulting mixture was diluted with brine (50 mL) and extracted with ethyl acetate (3 x 100 mL). The combined organic layers were dried over anhydrous magnesium sulfate and concentrated in vacuo. The crude product was purified by flash chromatography on silica gel (EtOAc:Petroleum ether 1:1 — EtOAc — EtOAc:MeCN 15:1) to give the title compound 10 as a light yellow solid (0.240 g, 0.898 mmol, 90%). TLC (EtOAc) R; = 0.33, visualized by UV lamp (A = 254 nm). 'H NMR (500 MHz, CDCI) 5 7.20 (dd, J = 15.5, 10.5 Hz, 1H), 6.68 (dd, J = 17.0, 10.5 Hz, 1H), 6.02 (d, J = 17.5 Hz, 1H), 5.89 (d, J = 15.5 Hz, 1H), 4.11 (d, J = 17.0 Hz, 2H), 3.79 (d, J = 17.0 Hz, 2H), 3.67 (s, 3H), 2.82 (s, 3H). 3C NMR (125 MHz, CDCI,) 5 168.8, 167.3, 145.4, 140.9, 122.4, 61.7, 51.6, 47.2. ''B NMR (100 MHz, CDCI,) 6 9.9. IR (thin film, cm'') 3005, 1751, 1734, 1718, 1701, 1696, 1685, 1654, 1595, 1560, 1437, 1334, 1281, 1233, 1129, 991, 863, 716, 662. S8"	Paper9_SIa	8	211	161	2339	3130
1064	-1	HRMS (ESI) Calculated for C,,H,,BNO,Na (M+Na)*: 290.0812 Found: 290.0812	Paper9_SIa	8	211	2504	1447	2668
1065	-1	Lee, Gray, Paek, and Burke A TS MeN MeN 11 \ in Pd(PPhs)4, Cul f os 0 Bre S~ ‘o~No Piperidine Za THF, 23°C TMS 45 BB, 0 3 h, 73% (E)-2-trimethylsilylethyleneboronate ester (12) MeN Loo AN ‘Oo Oo TMS 12 TLC (EtOAc) R, = 0.60, visualized by UV lamp (A = 254 nm) or with KMnQ,,. 'H NMR (500 MHz, CDCI,) 5 6.12 (d, J = 18.0 Hz, 1H), 6.04 (d, J = 18.5 Hz, 1H), 4.08 (d, J = 17.0 Hz, 2H), 3.70 (d, J = 17.0 Hz, 2H), 2.82 (s, 3H), 0.15 (s, 9H). 3C NMR (125 MHz, CDCI,) 5 168.7, 123.7, 104.6, 96.4, 61.6, 47.2, -0.2. ''B NMR (100 MHz, CDCI,) 6 11.5. IR (thin film, cm'') 3016, 2959, 2898, 2152, 1760, 1600, 1451, 1423, 1342, 1293, 1251, 1170, 1116, 1066, 1025, 1003, 953, 842, 760, 734, 679. S9	Paper9_SIa	9	211	161	2339	3130
1066	-1	"A 30 mL Wheaton vial equipped with a magnetic stir bar was charged with BB, (0.262 g, 1.00 mmol, 1.0 eq.), Pd(PPh), (0.058 g, 0.050 mmol, 5.0 mol%), Cul (0.019 g, 0.100 mmol, 10.0 mol%), piperidine (0.227 mL, 2.30 mmol, 3.0 eq.), THF (5.0 mL), and trimethylsilylacetylene (11) (0.166 mL, 1.15 mmol, 1.5 eq.). The vial was then sealed with a PTFE-lined plastic cap, and the reaction mixture was stirred at 23 °C for 3 h. The resulting mixture was diluted with EtOAc (5.0 mL) and filtered through a short pad of silica gel using EtOAc (100 mL). The filtrate was concentrated in vacuo, and the resulting crude product was purified by flash chromatography on silica gel (EtOAc:Petroleum ether 1:1 —> EtOAc) to give the title compound 12 as a colorless crystalline solid (0.203 g, 0.728 mmol, 73%). HRMS (ESI) Calculated for C,,H,,B NO,Si (M+H)"": 280.1176 Found: 280.1178"	Paper9_SIa	9	211	888	2341	2636
1067	-1	Lee, Gray, Paek, and Burke Me Me Me~\-O O~/ Me B-B t Me Oo O-v- Me Me 13 M le MeN MeN \e 5a 71% (E)-(2-pinacolethenyl)boronate ester (14) A solution of the catalyst was prepared as follows: A 20 mL Wheaton vial equipped with a magnetic stir bar was charged with PdCl,(CH;CN), (7.9 mg, 0.030 mmol, 1.0 eq.) and 2-dicyclohexylphosphino-2’ ,6’- dimethoxy-1,1’-bipheny] (5a) (38.0 mg, 0.090 mmol, 3.0 eq.). Toluene (3.00 mL) was added and the vial was sealed with a PTFE-lined plastic cap. The resulting mixture was stirred at 23 °C for 30 min yielding a clear yellow Pd/5a catalyst solution. TLC (EtOAc) > R, = 0.23, visualized with KMnO,. YO 'H NMR (500 MHz, CD,CN) 5 6.67 (d, J = 20.5 Hz, 1H), 6.11 (d, J=21.0 Hz, 1H), 3.96 (d, J = 17.0 Hz, 2H), 3.80 (d, J = 17.0 Hz, 2H), 2.76 (s, 3H), 1.22 (s, 12H). 3C NMR (125 MHz, CD,CN) 5 169.4, 84.1, 62.5, 47.7, 25.1. HRMS (ESI) Calculated for C,,H,,NO,B, (M+H)*: = 310.1633 Found: 310.1638 S10	Paper9_SIa	10	209	161	2340	3130
1068	-1	2 3 2 Me . N y\\. PdCla(CHsCN) 0, ~ Rolo ~~ Bolo B 0 <o This catalyst solution was then utilized in the following procedure: A 30 mL Wheaton vial equipped with a magnetic stir bar was charged with BB, (0.262 g, 1.00 mmol, 1.0 eq.), bis(pinacolato)diboron (13) (0.324 g, 1.25 mmol, 1.25 eq.), potassium acetate (0.297 g, 3.00 mmol, 3.0 eq.), toluene (5.0 mL), and catalyst solution (3.0 mL, 3.0 mol% Pd). The vial was sealed with a PTFE-lined plastic cap, and the reaction mixture was stirred for 36 h at 45 °C. The resulting heterogeneous mixture was diluted with ethyl acetate (5.0 mL) and filtered through short pad of Celite. Concentration of the filtrate in vacuo provided a light yellow solid. This crude product was purified by flash chromatography on silica gel (EtOAc:Petroleum ether 1:1 — EtOAc — EtOAc:MeCN 15:1) to give the title compound 14 as a colorless crystalline solid (0.219 g, 0.710 mmol, 71%). Crystals suitable for X-ray crystallography analysis were grown by slow evaporation from EtOAc at 23 °C. This material was stored under air at 23 °C for one year and six months without decomposition.	Paper9_SIa	10	210	481	2340	1895
1069	-1	Bre S oO oO CO KOAc ee oO PhMe BB PCy. ° Me 14	Paper9_SIa	10	559	578	1803	699
1070	-1	Lee, Gray, Paek, and Burke ''B NMR (100 MHz, CD,CN) 5 29.7 (sp’), 10.2 (sp’). sp?-hybridized sp2-hybridized poy 8 g un o a | \ } 4 I ot / \ /\ fo! ee ee” NL _ __/ NS ee T T T T l T T T T T T ~~ T Ty Tr 40 30 20 10 0 IR (thin film, cm’) 2979, 1762, 1701, 1654, 1560, 1458, 1374, 1332, 1297, 1144, 1110, 1088, 1024, 967, 878, 847, 809, 673. Sil	Paper9_SIa	11	211	161	2339	3130
1071	-1	Lee, Gray, Paek, and Burke MeN Bu,sn7 ~~ 2nCl MeN 1 _~ £80 ° Yes Jodo Br oo Bussn~ S~ S~9~Sg BB die, POA, = 8 1 PCy> THF, 0°C 16 MeO Oy OMe 2 h, 66% 5a (E,E)-1,3-butadienyl-4-(tributylstannyl)boronate ester (16) MeN bo BusSn~ “~~ ‘o~ So 16 TLC (EtOAc) R,; = 0.45, visualized with KMnO,. 'H NMR (500 MHz, acetone-d,) 6 6.65 (dd, J = 9.5, 18.5 Hz, 1H), 6.52 (dd, J = 10.0, 17.5 Hz, 1H), 6.31 (d, J = 18.5 Hz, 1H), 5.63 (d, J = 17.0 Hz, 1H), 4.21 (d, J = 17.0 Hz, 2H), 4.03 (d, J = 17.0 Hz, 2H), 3.00 (s, 3H), 1.54 (m, 6H), 1.32 (m, 6H), 0.95 (t, J = 8.0 Hz, 6H), 0.88 (t, J = 7.5 Hz, 9H). '3C NMR (125 MHz, acetone-d,) 6 169.0, 150.2, 146.2, 135.2, 62.3, 47.3, 29.9, 27.9, 13.9, 9.9. ''B NMR (100 MHz, acetone-d,) 6 11.3. $12	Paper9_SIa	12	211	161	2339	3130
1072	-1	A solution of the catalyst was prepared as follows: To a 4 mL vial equipped with a magnetic stir bar and containing 2-dicyclohexylphosphino-2’,6’-dimethoxy-1,1’-biphenyl (5a) (15.2 mg, 0.037 mmol, 2.0 eq.) was added a solution of Pd(OAc), in THF (0.095 M, 0.19 mL, 0.018 mmol, 1.0 eq.). The vial was sealed with a PTFE-lined cap and maintained at 23 °C with stirring for 15 min. yielding a clear yellow Pd/5a catalyst solution.	Paper9_SIa	12	209	813	2339	1089
1073	-1	This catalyst solution was then utilized in the following procedure: (E)-2-(tributylstannyl)vinylzinc chloride (15) was prepared according to literature precedent®: To a solution of trans-1,2-bis(tri-n- butylstannyl)ethylene (231 mg, 0.382 mmol, 2.0 eq.) in THF (0.4 mL) at -78 °C was added n- butyllithium (1.55 M in hexanes, 0.27 mL, 0.42 mmol, 2.2 eq.). After 30 min at —78 °C, a freshly prepared solution of ZnCl, (57 mg, 0.42 mmol, 2.2 eq.) in THF (0.84 mL) was added causing rapid decoloration. The solution was then warmed to —20 °C. During the formation of Negishi reagent 15, to a slurry of BB, (50 mg, 0.191 mmol, 1.0 eq.) in THF (0.2 mL) at 23 °C was added the catalyst stock solution described above (0.10 mL, 0.0095 mmol Pd, 5 mol% Pd) and the resulting slurry was stirred for 30 min before cooling to 0 °C. Negishi reagent 15 was then cannulated into the BB, solution over 5 min. After 2 h at 0 °C the reaction was diluted with EtOAc (10 mL) and then concentrated in vacuo. The resulting red oil was dissolved in EtOAc and filtered through a short pad of silica gel with a copious amount of EtOAc, and the filtrate was concentrated in vacuo. The resulting crude product was purified by flash chromatography on silica gel (EtOAc:hexanes 1:1 — EtOAc) to yield 16 as a pale yellow foam (62.2 mg, 0.125 mmol, 66%).	Paper9_SIa	12	210	1102	2339	1898
1074	-1	"Lee, Gray, Paek, and Burke HRMS (CI+) Calculated for C,,H,,O,NBSn (M+H)"": 500.1994 Found: 500.1992 IR (thin film, cm'') 2955, 2925, 2871, 2848, 1762, 1616, 1557, 1463, 1338, 1289, 1167, 1116, 1022, 957, 873, 844. $13"	Paper9_SIa	13	211	161	2339	3130
