docno	r_avail	text	Docno	Page	x1	y1	x2	y2
458	-1	To a 20 mL I-Chem vial equipped with a stir bar was added 14 (320 mg, 1.05 mmol, 1.0 eq.), finely ground anhydrous K,PO, (669 mg, 3.15 mmol, 3.0 eq.), PdCl,dppf-CH,Cl, (26 mg, 0.32 mmol, 3 mol%), and (E)-1-chloro-2-iodoethylene (17)* (396 mg, 2.10 mmol, 2.0 eq.). The vial was sealed with a PTFE- lined cap and DMSO (8.4 mL) was added via syringe. The resulting mixture was stirred at 23 °C for 9 h. The reaction was quenched with the addition of 0.5 M pH 7 phosphate buffer (8 mL) and the resulting mixture was extracted with THF:Et,O 1:1 (4 x 15 mL). The combined organic extracts were washed with brine (25 mL), dried over Na,SO,, and concentrated in vacuo. The resulting residue was diluted with acetone (15 mL) and concentrated onto Florisil®. The resulting powder was dry-loaded on top of a silica gel column and flash chromatography was performed (hexanes:EtOAc 1:1 — EtOAc — EtOAc:MeCN 9:1) to yield BB, as a colorless crystalline solid (139 mg, 0.571 mmol, 54%). HRMS (EI+) Calculated for C,H,,O,NCIB (M)*: 243.0469 Found: 243.0467	Paper9_SIa	14	210	867	2339	2727
459	-1	A 30 mL Wheaton vial equipped with a magnetic stir bar was charged with Pd,(dba), (0.021 g, 0.023 mmol, 1.5 mol%), Ph,As (0.014 g, 0.046 mmol, 3.0 mol%), 16 (0.760 g, 1.53 mmol, 1.0 eq.) as a solution in DMF (5.0 mL), and finally (£)-1-chloro-2-iodoethylene (0.575 g, 3.05 mmol, 2.0 eq.). The vial was sealed with a PTFE-lined plastic cap, and the reaction mixture was stirred at 23 °C for 3.5 h. To the resulting deep reddish mixture was then added saturated aqueous Na,S,O,; (50 mL) and the resulting mixture was extracted with EtOAc (3 x 85 mL). The combined organic extracts were washed with brine (3 x 50 mL), dried over anhydrous magnesium sulfate, and concentrated in vacuo to provide an orange solid. This crude product was purified by flash chromatography on Florisil® (petroleum ether:EtOAc 1:1 — EtOAc — EtOAc:MeCN 9:1) to give the title compound BB; as a light yellow solid (0.297 g, 1.10 mmol, 72%). x \ 2D BLD Oo HRMS (ESI) Calculated for C,,H,,BNO,Cl (M+H)*: 270.0704 Found: 270.0717	Paper9_SIa	15	210	819	2339	2607
460	-1	Lee, Gray, Paek, and Burke B(OH)». MeN (tS MeN 2 cnn“ ‘o- So a (b§$ “Yr ‘Oo O BB, pcy, Pd(OACc)» Me 19 -Pr Cs2COsz, THF Pr S 5b 45 °C, 24h, 64% -Pr (E,E,E,E)-1,3,5,7-undecatetraenylboronate ester (19) MeN Loo (B@SYowYPere se 9S 0 Me TLC (EtOAc) R,= 0.48, visualized by UV lamp (A = 254 and 365 nm) or with KMnQ,. 'H NMR (500 MHz, acetone-d,) 6 6.60 (dd, J = 9.5, 17.0 Hz, 1H), 6.36-6.25 (m, 3H), 6.20 (dd, J = 10.0, 14.5 Hz, 1H), 6.12 (dd, J = 10.5, 15.0 Hz, 1H), 5.76 (td, J = 7.0, 15.5 Hz, 1H), 5.67 (d, J = 17.5 Hz, 1H), 4.22 (d, J = 16.5 Hz, 2H), 4.02 (d, J = 17.0 Hz, 2H), 2.99 (s, 3H), 2.07 (app q, J = 7.5 Hz, 2H), 1.40-1.36 (m, 2H), 0.89 (t, J = 7.5 Hz, 3H). '3C NMR (125 MHz, acetone-d,) 6 169.0, 143.4, 136.3, 135.1, 135.0, 134.8, 131.7, 131.5, 62.3, 47.3, 35.5, 23.1, 13.9. ''B NMR (100 MHz, acetone-d,) 6 11.2. IR (thin film, cm'') 3008, 2961, 2929, 2858, 1766, 1744, 1459, 1342, 1294, 1254, 1155, 1124, 1010, 988, 955, 868. S16	Paper9_SIa	16	211	161	2342	3130
461	-1	A solution of the palladium catalyst was prepared as follows: To a 4 mL vial equipped with a stir bar and containing 2-dicyclohexylphosphino-2’,4’ ,6’-tri-iso-propyl-1,1’-biphenyl (5b) (3.0 mg, 0.0063 mmol, 2.0 eq.) in THF (0.577 mL) was added a solution of Pd(OAc), in THF (0.00547 M, 0.577 mL, 0.0032 mmol, 1.0 eq.). The vial was sealed with a PTFE-lined cap and stirred at 23 °C for 15 min. 19 HRMS (ESI) Calculated for C,,H,;BNO, (M+H)*: 304.1720 Found: 304.1711	Paper9_SIa	16	209	780	2339	2878
462	-1	This catalyst solution was then utilized in the following procedure: To a 7 mL vial equipped with a magnetic stir bar and containing BB, (11.0 mg, 0.0408 mmol, 1.0 eq.) was added (£)-1-penten-1- ylboronic acid (18) (7.0 mg, 0.0612 mmol, 1.5 eq.), Cs,CO, (39.9 mg, 0.122 mmol, 3.0 eq.), THF (0.835 mL) and the catalyst solution (0.298 mL, 2 mol% Pd). The resulting mixture was then sealed with a PTFE-lined plastic cap and stirred at 45 °C for 24 h. (BB; and product 19 were best separated on TLC plates by eluting twice with EtOAc). The resulting heterogeneous mixture was diluted with ethyl acetate (~1.0 mL) and filtered through a thin pad of Florisil® with copious amounts of EtOAc. The crude product was purified by flash chromatography on Florisil® (petroleum ether:EtOAc 1:1 — EtOAc — EtOAc:MeCN 15:1) to give the title compound 19 as a yellow solid (7.9 mg, 0.0261 mmol, 64%).	Paper9_SIa	16	210	1011	2340	1524
463	-1	"Lee, Gray, Paek, and Burke III. Total synthesis of all-trans-retinal (23) MeN ¢ Bro B-O4 -O MeN Me. Me Me Oo” *O Me Me Me ""7 ~ HX B(OH)2 BB, Sw PRROUSR BO o O Pd(OAc)> Me 20 PCy. K3PO, Me 21 MeO @ OMe ioluene, 23 °C 5a 60h, 78% Boronate ester 21 TLC (EtOAc) R,; = 0.45, visualized with KMnO,. 'H NMR (500 MHz, acetone-d,) § 6.98 (dd, J = 11.0, 17.0 Hz, 1H), 6.23 (d, J = 16.0 Hz, 1H), 6.13 (d, J = 11.5 Hz, 1H), 6.10 (d, J = 16.0 Hz, 1H), 5.71 (d, J = 17.0 Hz, 1H), 4.21 (d, J = 17.0 Hz, 2H), 4.03 (d, J = 17.0 Hz, 2H), 3.00 (s, 3H), 2.01 (app t, J = 6.0 Hz, 2H), 1.94 (d, J = 1.0 Hz, 3H), 1.68 (d, J = 1.0 Hz, 3H), 1.63- 1.58 (m, 2H), 1.48-1.45 (m, 2H), 1.01 (s, 6H). '3C NMR (125 MHz, acetone-d,) 6 169.1, 140.9, 139.3, 138.7, 136.7, 133.1, 129.6, 127.9, 62.2, 47.4, 40.2, 34.8, 33.5, 29.2, 21.9, 19.9, 12.7. S17"	Paper9_SIa	17	211	161	2342	3130
464	-1	A solution of the catalyst was prepared as follows: To a4 mL vial equipped with a stir bar and containing 2-dicyclohexylphosphino-2’ ,6’-dimethoxy-1,1’-bipheny] (5a) (23.1 mg, 0.056 mmol, 2.0 eq.) was added a solution of Pd(OAc), in toluene (0.038 M, 0.740 mL, 0.028 mmol, 1.0 eq.). The vial was sealed with a PTFE-lined cap and maintained at 65 °C with stirring for 15 min. ''B NMR (100 MHz, acetone-d,) 6 11.7.	Paper9_SIa	17	209	929	2340	2955
465	-1	This catalyst solution was then utilized in the following procedure: To a 40 mL J-Chem vial equipped with a magnetic stir bar and containing a solution of 20° in toluene (estimated 0.17 M, 11.5 mL, 1.96 mmol, 1.5 eq.) was added anhydrous K,PO, as a finely ground powder (0.833 g, 3.92 mmol, 3.0 eq.), BB, (0.342 g, 1.30 mmol, 1.0 eq.), and the catalyst solution (0.688 mL, 0.026 mmol Pd, 2 mol% Pd). The resulting mixture was sealed with a PTFE-lined cap and stirred at 23 °C for 60 h. The mixture was then filtered through a pad of silica gel with copious amounts of acetonitrile. To the resulting solution was added Florisil® and the solvent was removed in vacuo. The resulting powder was dry-loaded on top of a silica gel column and flash chromatography was performed (hexanes:EtOAc 1:1 — EtOAc = EtOAC:MeCN 9:1) to yield the title compound 21 as a yellow powder (0.377 g, 1.02 mmol, 78%).	Paper9_SIa	17	210	1160	2341	1671
466	-1	MIDA boronate 21 was converted to boronic acid 32 via the following procedure: In a 7 mL Wheaton vial, to a stirred solution of 21 (35.9 mg, 0.101 mmol, 1.0 eq.) in THF (1.44 mL) at 23 °C was added 1 M aq. NaOH (0.30 mL, 0.30 mmol, 3.0 eq.) and the resulting mixture was stirred for 15 min. The reaction was then quenched with the addition of 0.5 M pH 7 phosphate buffer (1.5 mL) and diluted with Et,O (1.5 mL). The layers were separated and the aqueous layer was extracted with THF:Et,O 1:1 (3 x 3 mL). The combined organic layers were dried over MgSO, and concentrated in vacuo until a small amount of THF (~1 mL) remained, yielding a solution of 32; TLC: (EtOAc) R; = 0.70, visualized by KMnQO,.	Paper9_SIa	18	210	1217	2340	1608
467	-1	A solution of the palladium catalyst was prepared as follows: To a 1.5 mL vial equipped with a magnetic stir bar and containing 2-dicyclohexylphosphino-2’,6’-dimethoxy-1,1’-biphenyl (5a) (3.6 mg, 0.0088 mmol, 2.0 eq.) was added a solution of Pd(OAc), in toluene (0.038 M , 0.115 mL, 0.0044 mmol, 1.0 eq.). The vial was sealed with a PTFE-lined cap and maintained at 65 °C with stirring for 15 min.	Paper9_SIa	18	209	1621	2338	1839
468	-1	"This catalyst solution was then utilized in the following procedure: To a 4 mL vial equipped with a magnetic stir bar and containing enal 22° (10 mg, 0.067 mmol, 1.0 eq.) was added boronic acid 32 as a solution in THF (estimated 0.101 M, 1 mL, 0.101 mmol, 1.5 eq.), anhydrous K,PO, as a finely ground powder (42.6 mg, 0.201 mmol, 3.0 eq.), and the catalyst stock solution described above (0.035 mL, 0.0013 mmol Pd, 2 mol% Pd). The resulting mixture was sealed with a PTFE-lined cap and stirred at 23 °C for 5 h. The reaction was then quenched with the addition of saturated aqueous NaHCO, (2 mL). The layers were separated and the aqueous layer was extracted with Et,O (3 x 5 mL). The combined organic layers were dried over Na,SO, and concentrated in vacuo. The crude material was purified by flash chromatography (hexanes:EtOAc 32:1) to yield all-trans-retinal (23) as a bright yellow solid (12.6 mg, 0.044 mmol, 66%). 'H NMR"", °C NMR”, HRMS, and IR"" analysis of synthetic 23 were fully consistent with the data reported for the isolated natural product."	Paper9_SIa	18	210	1852	2340	2474
469	-1	In an unoptimized procedure, a 150 mL bomb flask equipped with a magnetic stir bar was charged with BH,-SMe, (1.8 mL, 19.4 mmol, 1.0 eq.) and THF (11 mL). The solution was cooled to 0 °C and (+)-a- pinene (6.3 mL, 39.7 mmol, 2.0 eq.) was added dropwise. The solution was stirred at 0 °C for 10 min then allowed to warm to 23 °C and stirred at 23 °C for 2 h, during which time a white precipitate formed. The solution was then recooled to 0 °C and an excess of 1-butyne (33) was condensed into the reaction via a balloon resulting in a clear, colorless solution. The flask was then sealed with a Teflon screw cap and was stirred at 0 °C for 30 min, warmed to 23 °C, and stirred at 23 °C for 1.5 h. The solution was recooled to 0 °C and acetaldehyde (10.4 mL, 185 mmol, 9.5 eq.) was added. The bomb flask was resealed with the Teflon screw cap and the reaction was stirred at 40 °C for 14h. The reaction was allowed to cool to 23 °C and water (5 mL) was added. After stirring for 3 h at 23 °C, the solution was diluted with EtOAc (50 mL), dried over MgSO,, and concentrated in vacuo. The resulting residue was taken up in hexanes (50 mL) and the resulting mixture was extracted with 10% aqueous NaOH (2 x 10 mL). The combined aqueous extractions were washed with hexanes (2 x 20 mL) and then acidified to pH 2-3 with concentrated hydrochloric acid. The acidified aqueous layer was then extracted with EtOAc (3 x 30 mL), and the combined organic extracts were washed with saturated aq. NaHCO, (50 mL), dried over MgSO,, and concentrated in vacuo to yield the title compound 24 as a colorless solid (0.928 g, 9.3 mmol, 48%). HRMS (EI+) Calculated for C,H,O,B (M)’: 100.0696 Found: 100.0696	Paper9_SIa	21	210	856	2339	2876
470	-1	"Lee, Gray, Paek, and Burke ""Los ci SL BORO MeN AW BOM BB, AAW 8889 M Pd(OAc) © 24 S PCy, KPO, : Me 25 Pr #Pr THE, 45 °C Ss bb 36h, 88% i-Pr (E,E,E)-1,3,5-Octatrienylboronate ester (25) MeN y\. ows sox oO Me 25 TLC (EtOAc) R; = 0.35, visualized by UV lamp (A = 254 nm). 'H NMR (500 MHz, acetone-d,) 6 6.56 (dd, J = 10.0, 17.5 Hz, 1H), 6.26 (dd, J = 10.5, 15.0 Hz, 1H), 6.19 (dd, J = 10.0, 15.0 Hz, 1H), 6.10 (tdd, J = 1.5, 10.0, 15.0 Hz, 1H), 5.80 (td, J = 6.5, 15.0 Hz, 1H), 5.63 (d, J = 17.0 Hz, 1H), 4.19 (d, J = 17.0 Hz, 2H), 4.02 (d, J = 17.0 Hz, 2H), 2.98 (s, 3H), 2.11 (m, 2H), 0.98 (t, J = 7.5 Hz, 3H). '3C NMR (125 MHz, acetone-d,) 6 168.0, 143.5, 138.3, 134.8, 133.6, 130.4, 62.3, 47.3, 26.4, 13.8. ''B NMR (100 MHz, acetone-d,) 6 11.6. $22"	Paper9_SIa	22	211	161	2340	3130
471	-1	A solution of the palladium catalyst was prepared as follows: To a 4 mL vial equipped with a magnetic stir bar and containing 2-dicyclohexylphosphino-2’,4’,6’-tri-iso-propyl-1,1’-biphenyl (5b) (17.3 mg, 0.036 mmol, 2.0 eq.) was added a solution of Pd(OAc), in THF (0.0109 M, 1.664 mL, 0.018 mmol, 1.0 eq.). The vial was sealed with a PIFE-lined cap and stirred at 23 °C for 30 min. HRMS (EI+) Calculated for C,,H,,O,NB (M)*: 263.1329 Found: 263.1331	Paper9_SIa	22	209	923	2339	3053
472	-1	This catalyst solution was then utilized in the following procedure: To a 20 mL J-Chem vial equipped with a stir bar and containing (£)-1-butenylboronic acid (24) (113 mg, 1.13 mmol, 2.0 eq.) was added BB, (138 mg, 0.521 mmol, 1.0 eq.), anhydrous K,PO, as a finely ground powder (301 mg, 1.42 mmol, 2.5 eq.), THF (7.9 mL), and the catalyst solution (0.780 mL, 0.0085 mmol Pd, 1.5 mol% Pd). The resulting mixture was sealed with a PTFE-lined cap and stirred at 45 °C for 23 h. (BB, and product 25 were best separated on TLC plates by eluting three times with hexanes:EtOAc 2:3). The mixture was then filtered through a pad of silica gel with copious amounts of acetonitrile. To the resulting solution was added Florisil® gel and then the solvent was removed in vacuo. The resulting powder was dry-loaded on top of a silica gel column and flash chromatography was performed (Et,O — Et,O:MeCN 4:1) to yield the title compound 25 as a yellow powder (120 mg, 0.456 mmol, 88%).	Paper9_SIa	22	211	1154	2341	1721
473	-1	"Lee, Gray, Paek, and Burke IR (thin film, cm'') 3017, 1768, 1216, 1026, 1010, 756, 668. CrCl, CHls 2 dioxane:THF 6:1! CO,Me 34 23 °C, 12h, 63% 35 Vinyl iodide 35 IW “SS cone 35 TLC (hexanes:EtOAc 4:1) R,; = 0.45, visualized with KMnO,. 'H NMR (400 MHz, CDCI) 5 6.49 (td, J = 7.2, 14.4 Hz, 1H), 5.96 (td, J = 1.6, 14.0 Hz, 1H), 3.66 (s, 3H), 2.29 (t, J = 7.6 Hz, 2H), 2.03 (dq, J = 1.2, 6.8 Hz, 2H), 1.64-1.56 (m, 2H), 1.42-1.33 (m, 2H), 1.33-1.24 (m, 6H). 3C NMR (100 MHz, CDCI,) 5 174.2, 146.6, 74.4, 51.5, 36.0, 34.0, 29.0, 28.9, 28.7, 28.2, 24.8. HRMS (CI+) Calculated for C,,H,,.O,I (M+H)"": 311.0508 Found: 311.0508 IR (thin film, cm'') 2927, 2855, 1738, 1435, 1197, 1172, 946. $23"	Paper9_SIa	23	211	161	2339	3130
474	-1	In an unoptimized procedure, to a suspension of CrCl, (454 mg, 3.75 mmol, 7.0 eq.) in THF (1.5 mL) at 23 °C was added dropwise a solution of (E)-methyl 10-iododec-9-enoate (34)’ (100 mg, 0.537 mmol, 1.0 eq.) and iodoform (422 mg, 1.07 mmol, 2.0 eq.) in dioxane (9.2 mL). After stirring for 12 h, the reaction mixture was diluted with Et,O (10 mL) and poured into water (10 mL). The layers were separated and the aqueous layer was extracted with Et,O (3 x 15 mL). The combined organic extracts were washed with brine (10 mL), dried over MgSO,, and concentrated in vacuo. Purification of the crude product by flash chromatography (hexanes — hexanes:EtOAc 9:1) provided the title compound 35 as a yellow oil (105 mg, 0.337 mmol, 63%). 'H NMR indicated an E:Z ratio of 10:1.	Paper9_SIa	23	210	869	2341	1320
475	-1	MIDA boronate 25 was converted to boronic acid 36 via the following procedure: To a stirred solution of 25 (24.7 mg, 0.094 mmol, 1.0 eq.) in THF (1.34 mL) at 23 °C was added | M aq. NaOH (0.28 mL, 0.28 mmol, 3.0 eq.) and the resulting mixture was stirred at 23 °C for 15 min. The reaction was then quenched with the addition of 0.5 M pH 7 phosphate buffer (1.5 mL) and diluted with Et,O (1.5 mL). The layers were separated and the aqueous layer was extracted with THF:Et,O 1:1 (3 x 3 mL). The combined organic layers were dried over MgSO, and concentrated in vacuo until a small amount of THF (~3.7 mL) remained, yielding a solution of 36; TLC (EtOAc): R; = 0.63, visualized with KMnQ,.	Paper9_SIa	25	210	767	2342	1159
476	-1	A solution of the palladium catalyst was prepared as follows: To a 4 mL vial equipped with a magnetic stir bar and containing 2-dicyclohexylphosphino-2’ ,4’,6’-tri-iso-propyl-1,1’-biphenyl] ligand (5b) (2.1 mg, 0.0044 mmol, 2.0 eq.) was added a solution of Pd(OAc), in THF (0.004 M, 0.545 mL, 0.0022 mmol, 1.0 eq.). The vial was sealed with a PIFE-lined cap and stirred at 23 °C for 30 min.	Paper9_SIa	25	209	1171	2339	1390
477	-1	"This catalyst solution was then utilized in the following procedure: To a 20-mL I-Chem vial equipped with a magnetic stir bar and containing 26 (18.5 mg, 0.062 mmol, 1.0 eq.; E:Z 7:1 by 'H NMR) was added boronic acid 36 (3.7 mL, estimated 0.094 mmol, 1.5 eq.) and the catalyst solution described above (0.31 mL, 0.0013 mmol Pd, 2 mol% Pd). The resulting mixture was sealed with a teflon-lined septum cap and 1 M aqueous NaOH (0.19 mL, 0.190 mmol, 3.0 eq.) was added. The reaction was stirred at 23 °C for 40 min and was then quenched with the addition of saturated aqueous NH,Cl (3 mL). The layers were separated and the aqueous layer was extracted with Et,O (3 x 5 mL). The combined organic extracts were dried over Na,SO, and concentrated in vacuo. The resulting crude product was purified by flash chromatography (hexanes:Et,O 4:1 — Et,O) to yield B-parinaric acid 27 as a fluorescent solid (14.8 mg, 0.054 mmol, 86%). 'H NMR indicated a 7:1 mixture of B-parinaric acid:9-(Z) parinaric acid (arising from 7:1 E:Z mixture of starting material 26). 'H NMR and ""°C NMR analysis of synthetic 27 were fully consistent with the data previously reported for B-parinaric acid.'*""°"	Paper9_SIa	25	210	1402	2341	2087
478	-1	Lee, Gray, Paek, and Burke V. Synthesis of 4% of the amphotericin B macrolide (31) Figure S1. Synthesis of 30. oO | TESOTE OH OH ; LA OAc OH 2,6-lutidine OAc OTES Me“ ~~~ ~O Lipase PS Me“ ~~ 07 CHCl, -78°C Me “~o Me Me hexanes, 50 °C Me Me 1h, 88% Me Me 40 h, 76% 37 38 39 Me Me oe (COCI), DMSO Meio” \g CHClo, -78 °C OAc OTES Pd black, Hp OAc QTES SO nmin: a Me 42 EtOH :EtOAc2:1 Me = OH | me ie : C2: : Et3N, -15 °C Me Me CrClo, Lil 23 °C, 25h, 91% Me Me 40 min, 93% THF, 23 °C 40 41 7h, 68% Me | e YQ2™. OAc OTES oN ie a cl OAc OTES : Pd(PPhs)4, 3 M ag. NaOH, Me Me Me Me THF, 23 °C , 17h, 71% 43 30 O OH OH | = OE LA Me QAc OH Me - 0 Lipase PS, hexanes Me < O Me Me 50 °C, 40 h, 76% Me Me 37 38 Acetate 38 A 200 mL recovery flask was charged with diol 37° (1.18 g, 4.69 mmol, 1.0 eq.), Lipase PS (295 mg, 0.25 mass eq), and hexanes (115 mL) and the resulting slurry was stirred at 50 °C for 15 min. Vinyl acetate (4.33 mL, 47.0 mmol, 10.0 eq) was then added and the reaction mixture was stirred at 50 °C for 40 h. The resulting mixture was cooled to 23 °C and filtered, and the residual enzyme was washed copiously with Et,O. The filtrate was then concentrated in vacuo and the resulting viscous, light yellow oil was purified by flash column chromatography (hexanes:EtOAc 15:1 — 1:1) to yield 38 as a pale yellow oil (1.05 g, 3.57 mmol, 76%). $27	Paper9_SIa	27	210	161	2339	3130
479	-1	Lee, Gray, Paek, and Burke TLC (hexanes:EtOAc 1:1) R,; = 0.60, visualized with p-anisaldehyde. 'H NMR (400 MHz, CDCI1,) 5 7.37-7.29 (m, 5H), 5.32 (dq, J = 4.0, 6.4 Hz,1H), 4.54 (d, J = 12.0 Hz, 1H), 4.49 (d, J = 12.0 Hz, 1H), 3.61-3.53 (m, 3H), 2.66 (d, J = 3.2 Hz, 1H), 2.03 (s, 3H), 1.97-1.91 (m, 1H), 1.91-1.84 (m, 170.4, 138.0, 128.4, 127.7, 127.6, 75.5, 74.9, 73.4, 71.4, 39.6, 34.7, 21.5, 13.8, 10.0, 9.1. HRMS (CI+) Calculated for C,,H,,O, (M+H)*: 295.1909 Found: 295.1905 IR (thin film, cm'') 3497, 2970, 2925, 2873, 1731, 1714, 1453, 1371, 1244, 1101, 1053, 1020, 737, 698. $28	Paper9_SIa	28	211	161	2339	3130
480	-1	Lee, Gray, Paek, and Burke OAc OH Me~ ~~ ~~ ~O Me Me 38 TESOTI 2,6-lutidine CHoClo, -78 °C 1h, 88% Me OAc OTES y Me Me 39 Oo Triethylsilyl ether 39 To a stirred solution of 38 (5.98 g, 20.31 mmol, 1.0 eq.) in CH,Cl, (230 mL) at 0 °C was added 2,6- lutidine (7.84 mL, 67.35 mmol, 3.3 eq.) and the resulting solution was cooled to —-78 °C. Triethylsilyl trifluoromethanesulfonate (7.11 mL, 31.43 mmol, 1.5 eq.) was then added dropwise and the resulting solution was stirred at -78 °C for 1 h. The reaction was then quenched with the addition of saturated aqueous NaHCO, (115 mL) and allowed to warm to 23 °C. The layers were separated and the aqueous layer was extracted with Et,O (3 x 200 mL). The combined organic extracts were dried over MgSO, and concentrated in vacuo to give a yellow oil. Purification by flash chromatography (hexanes:EtOAc 7:1 — 1:1) provided 39 as a yellow oil (7.34g, 17.96 mmol, 88%). Me TLC (hexanes:EtOAc 3:1) OAc OTES “~o Me Me 39 R,; = 0.67, visualized with p-anisaldehyde. 'H NMR (500 MHz, CDCI) 5 7.35-7.26 (m, 5H), 5.00 (app qn, J = 6.5 Hz, 1H), 4.49 (d, J = 11.5 Hz, 1H), 4.43 (d, J = 11.5 Hz, 1H), 3.85 (dd, J = 2.5, 7.0 Hz, 1H), 3.35 (app t, J = 8.5 Hz, 1H), 3.22 (dd, J = 6.0, 9.0 Hz, 1H), 1.96-1.86 (m, 2H), 1.91 (s, 3H), 1.14 (d, J = 6.5 Hz, 3H), 0.95 (t, J = 8.5 Hz, 9H), 0.87 (d, J = 7.0 Hz, 3H), 0.84 (d, J = 6.5 Hz, 3H), 0.60 (m, 6H). 3C NMR (125 MHz, CDCI,) 6 170.4, 138.6, 128.3, 127.7, 127.4, 73.7, 72.9, 72.2, 71.7, 42.6, 35.5, 21.3, 16.1, 11.2, 11.0, 7.0, 5.4. HRMS (ESI+) Calculated for C,,H,,O0,Si (M+H)’: Found: IR (thin film, cm'') 2953, 2875, 1734, 1453, 1369, 1243, 1093, 1046, 1005, 736, 696, 654. 409.2774 409.2765 S29	Paper9_SIa	29	211	161	2340	3130
481	-1	Lee, Gray, Paek, and Burke OAc OTES Pd black, Hp QAc OTES Mey 0 FIOH:EIOAca1 « Me~ OH Me Me 23 °C, 25h, 91% Me Me 39 40 Primary alcohol 40 Caution: palladium black is pyrophoric and should be maintained under inert atmosphere at all times. For this reaction, ECOH and EtOAc were freshly distilled over activated 4A molecular sieves. To a 25 mL three-neck round-bottomed flask equipped with a magnetic stir bar was added palladium black (17.3 mg, 0.163 mmol, 0.6 eq.). To this flask was then added via cannula a solution of benzyl ether 39 (111.0 mg, 0.271 mmol, 1.0 eq.) in Et1OH:EtOAc 2:1 (4.65mL). The reaction flask was purged with H, (balloon) and stirred at 23 °C for 25 h under a positive pressure of H, (balloon). The resulting mixture was then filtered under N, pressure through a short column of Celite, flushing with copious amounts of EtOH (Pd residue kept under solvent at all times). Purification by flash chromatography (hexanes:EtOAc 12:1 — 4:1) yielded primary alcohol 40 as a pale yellow oil (79.1 mg, 0.248 mmol, 91%). OAc OTES Me~ ~~ ~~ ~OH Me Me 40 TLC (hexanes:EtOAc 1:1) R; = 0.56, visualized with p-anisaldehyde. 'H NMR (500 MHz, CDCI,) 5 5.01 (app qn, J = 6.0 Hz, 1H), 3.85 (dd, J = 2.0, 6.0 Hz, 1H), 3.47 (m, 2H), 2.01 (s, 3H), 1.93 (m, 1H), 1.79 (m, 1H), 1.16 (d, J = 6.5 Hz, 3H), 0.97 (t, J = 8.0 Hz, 9H), 0.89 (d, J = 7.5 Hz, 3H), 0.84 (d, J = 7.0 Hz, 3H), 0.62 (q, J = 8.0 Hz, 6H). 3C NMR (125 MHz, CDCI,) 5 170.7, 72.4, 71.7, 66.2, 42.8, 38.0, 21.4, 16.5, 11.2, 11.2, 7.0, 5.3. HRMS (ESI+) Calculated for C,,H;,;0,Si (M+H)’: 319.2305 Found: 319.2310 IR (thin film, cm'') 3457, 2954, 2873, 1731, 1714, 1371, 1245, 1044. $30	Paper9_SIa	30	210	161	2340	3130
482	-1	"Lee, Gray, Paek, and Burke (COCI)>, DMSO OAc QTES CH.Cl, -78 °C OAc OTES Me~ ~~ ~~ ~OH 90 min; Me - - - So Me Me Et3N, -15 °C Me Me 40 min, 93% 40 41 Aldehyde 41 OAc OTES Me~ ~~ ~~ No Me Me 41 TLC (hexanes:EtOAc 1:1) R; = 0.76, stained by p-anisaldehyde. 'H NMR (400 MHz, CDCI,) 5 9.67 (d, J = 0.8 Hz, 1H), 4.99 (app qn, J = 6.4 Hz, 1H), 4.21 (dd, J = 2.8, 6.0 Hz, 1H), 2.44 (ddq, J = 0.8, 3.2, 7.2 Hz, 1H), 2.03 (s, 3H), 1.95 (m, 1H), 1.18 (d, J = 6.4 Hz, 3H), 1.14 (d, J = 7.2 Hz, 3H), 0.94 (t, J = 8.0 Hz, 9H), 0.90 (d, J = 6.8 Hz, 3H), 0.58 (q, J = 7.6 Hz, 6H). 3C NMR (125 MHz, CDCI,) 5 204.7, 170.3, 71.2, 71.2, 49.4, 42.7, 21.3, 16.3, 11.2, 8.3, 6.9, 5.2. HRMS (ESI+) Calculated for C,,H;,,0,SiNa (M+Na)"": 339.1968 Found: 339.1972 IR (thin film, cm'') 2953, 2877, 1731, 1708, 1458, 1372, 1241, 1049, 1010, 946, 740. S31"	Paper9_SIa	31	211	161	2339	3130
483	-1	To a stirred solution of oxalyl chloride (3.44 mL, 40.1 mmol, 5.0 eq.) in CH,Cl, (20 mL) at —78 °C was added dropwise DMSO (5.70 mL, 80.2 mmol, 10.0 eq.) and the resulting solution was stirred at —78 °C for 30 min. To the reaction was then added via cannula a solution of alcohol 40 (2.56 g, 8.02 mmol, 1.0 eq.) in CH,Cl, (55.7 mL) and the resulting solution was stirred at —78 °C for 1.5 h. Triethylamine (28 mL, 201 mmol, 25.0 eq.) was then added and the resulting mixture was allowed to warm to —15 °C over 40 min. The reaction was then quenched with the addition of saturated aqueous NH,Cl (50 mL). The layers were separated and the aqueous phase was extracted with CH,Cl, (3 x 50 mL). The combined organic layers were washed with brine (50 mL), dried over MgSO,, and concentrated in vacuo to yield aldehyde 41 as a yellow oil (2.36 g, 7.46 mmol, 93%).	Paper9_SIa	31	211	789	2339	1295
