docno	r_avail	text	Docno	Page	x1	y1	x2	y2
322	-1	Suzuki-Miyaura Cross-Coupling of 2-Pyridyl Ammonium Salts by N—C Activation Hu et al. Cr [Pd(IPr)(cin)Cl], Cs,CO3 | No ’ + Son” HO, Dioxane, 80 °C, &h 20 According to the general procedure, the reaction of N,N,N-trimethylpyridin-2-aminium trifluoromethanesulfonate (0.20 mmol, 1.0 equiv), furan-2-ylboronic acid (2.0 equiv), Cs2CO3 (2.0 equiv), water (5.0 equiv), and [Pd(IPr)(cin)Cl] (10 mol%) in dioxane (0.20 M) for 8 h at 80 °C, afforded after filtration and chromatography on silica gel (EtOAc/petroleum ether = 1:4) the title compound in 63% yield (18.4 mg). Brown oil. 'H NMR (500 MHz, CDCl) 5 8.56 (d, J = 4.7 Hz, 1H), 7.63 — 7.60 (m, 2H), 7.50 (d, J = 0.6 Hz, 1H), 7.09 — 7.05 (m, 2H), 6.50 (dd, J = 3.1, 1.6 Hz, 1H). °C NMR (126 MHz, CDCIs) 5 153.5, 149.5, 149.3, 143.2, 136.6, 121.9, 118.5, 112.0, 108.5. The characterization data matched those previously reported.” 2-(Furan-3-yl)pyridine (3p) (Scheme 2) | - NC Oy B(OM)2 [pa(IPr)(cin)Cl], Cs,CO, Na w, Ser 0 HO, Dioxane, 80 °C, 8h | OTf Z 2p 3p According to the general procedure, the reaction of N,N,N-trimethylpyridin-2-aminium trifluoromethanesulfonate (0.20 mmol, 1.0 equiv), furan-3-ylboronic acid (2.0 equiv), Cs2CO3 (2.0 equiv), water (5.0 equiv), and [Pd(IPr)(cin)Cl] (10 mol%) in dioxane (0.20 M) for 8 h at 80 °C, afforded after filtration and chromatography on silica gel (EtOAc/petroleum ether = 1:4) the title compound in 80% yield (23.3 mg). Brown oil. 'H NMR (500 MHz, CDCl) 5 8.57 (d, J = 4.1 Hz, 1H), 8.03 (d, J = 0.5 Hz, 1H), 7.62 (td, J = 7.8, 1.8 Hz, 1H), 7.48 (t, J = 1.6 Hz, 1H), 7.42 (d, J = 7.9 Hz, 1H), 7.14 — 7.07 (m, 1H), 6.92 — 6.87 (m, 1H). °C NMR (126 MHz, CDCIs) 6 151.8, 149.6, 143.9, 141.2, 136.6, 127.1, 121.7, 120.1, 108.6. The characterization data matched those previously reported.’ 6'-Methoxy-2,3'-bipyridine (3q) (Scheme 2) S16	Paper10_SI	16	301	160	2252	3034
323	-1	Suzuki-Miyaura Cross-Coupling of 2-Pyridyl Ammonium Salts by N—C Activation Hu et al. M iC B(OH) ; | one : Nw NN . i S 2 [Pd(IPr)(cin)Cl], CssCO3 : Nw ZN Z OTf Meo~ ~N~ H,0, Dioxane, 80 °C, 8h 2 According to the general procedure, the reaction of N,N,N-trimethylpyridin-2-aminium trifluoromethanesulfonate (0.20 mmol, 1.0 equiv), (6-methoxypyridin-3-yl)boronic acid (2.0 equiv), Cs2CO3 (2.0 equiv), water (5.0 equiv), and [Pd(IPr)(cin)Cl] (10 mol%) in dioxane (0.20 M) for 8 h at 80 °C, afforded after filtration and chromatography on silica gel (EtOAc/petroleum ether = 1:4) the title compound in 81% yield (30.0 mg). Yellow oil. 'H NMR (500 MHz, CDCls) 6 8.67 (d, J = 4.6 Hz, 1H), 8.24 — 8.20 (m, 2H), 7.96 (d, J = 8.0 Hz, 1H), 7.67 (td, J = 7.9, 1.5 Hz, 1H), 7.17 (dd, J = 6.9, 5.3 Hz, 1H), 7.01 (dd, J = 7.3, 5.0 Hz, 1H), 4.01 (s, 3H). °C NMR (126 MHz, CDCls) 6 161.0, 154.0, 149.5, 146.9, 139.4, 135.9, 124.6, 122.9, 122.2, 117.3, 53.5. The characterization data matched those previously reported.” 2'-Methoxy-2,3'-bipyridine (3r) (Scheme 2) |v NC (one [Pd(IPr)(cin)Cl], Cs;CO, Ton | HO, Dioxane, 80 °C, 8h According to the general procedure, the reaction of N,N,N-trimethylpyridin-2-aminium trifluoromethanesulfonate (0.20 mmol, 1.0 equiv), (2-methoxypyridin-3-yl)boronic acid (2.0 equiv), Cs2CO3 (2.0 equiv), water (5.0 equiv), and [Pd(IPr)(cin)Cl] (10 mol%) in dioxane (0.20 M) for 8 h at 80 °C, afforded after filtration and chromatography on silica gel (EtOAc/petroleum ether = 1:4) the title compound in 97% yield (36.0 mg). Yellow oil. 'H NMR (500 MHz, CDCls) 6 8.75 (d, J = 1.9 Hz, 1H), 8.64 (d, J = 4.0 Hz, 1H), 8.22 (dd, J = 8.7, 2.4 Hz, 1H), 7.67 (td, J = 7.9, 1.7 Hz, 1H), 7.61 (d, J = 7.9 Hz, 1H), 7.18 — 7.15 (m, 1H), 6.82 (d, J = 8.7 Hz, 1H), 3.98 (s, 3H). °C NMR (126 MHz, CDCls) & 164.5, 154.9, 149.7, 145.5, 137.2, 136.8, 128.5, 121.9, 119.6, 110.8, 53.6. The characterization data matched those previously reported.’ 2-Methoxy-5-(pyridin-2-yl)pyrimidine (3s) (Scheme 2) S17	Paper10_SI	17	301	160	2261	3034
324	-1	"Suzuki-Miyaura Cross-Coupling of 2-Pyridyl Ammonium Salts by N—C Activation Hu et al. |_- NON ry [Pd(IPr)(cin)Cl], CssCO3 if | - | Z. OTt eo NZ H,O, Dioxane, 80 °C, 8h 1a 2s According to the general procedure, the reaction of N,N,N-trimethylpyridin-2-aminium trifluoromethanesulfonate (0.20 mmol, 1.0 equiv), (2-methoxypyrimidin-5-yl)boronic acid (2.0 equiv), Cs2CO3 (2.0 equiv), water (5.0 equiv), and [Pd(IPr)(cin)Cl] (10 mol%) in dioxane (0.20 M) for 8 h at 80 °C, afforded after filtration and chromatography on silica gel (EtOAc/petroleum ether = 1:4) the title compound in 86% yield (32.2 mg). White solid. 'H NMR (500 MHz, CDCls) 6 9.03 (s, 2H), 8.60 (d, J = 4.1 Hz, 1H), 7.69 (td, J = 7.8, 1.6 Hz, 1H), 7.59 (d, J = 7.9 Hz, 1H), 7.21 — 7.18 (m, 1H), 3.99 (s, 3H). '3C NMR (126 MHz, CDCls) 8 165.7, 157.7, 152.2, 150.1, 137.1, 126.5, 122.7, 119.5, 55.1. The characterization data matched those previously reported. !° 2,4-Dimethoxy-5-(pyridin-2-yl)pyrimidine (3t) (Scheme 2) | 7 NONG NN BOM2 paciPny(einycll, Cs; | - |e - Z OTF eo oN OMe H20, Dioxane, 80 °C, 8h 1a 2t According to the general procedure, the reaction of N,N,N-trimethylpyridin-2-aminium trifluoromethanesulfonate (0.20 mmol, 1.0 equiv), (2,4-dimethoxypyrimidin-5-yl)boronic acid (2.0 equiv), Cs2CO3 (2.0 equiv), water (5.0 equiv), and [Pd(IPr)(cin)Cl] (10 mol%) in dioxane (0.20 M) for 8 h at 80 °C, afforded after filtration and chromatography on silica gel (EtOAc/petroleum ether = 1:4) the title compound in 70% yield (30.5 mg). White solid. 'H NMR (500 MHz, CDCls) 6 8.86 (s, 1H), 8.60 (d, J = 4.3 Hz, 1H), 7.77 (d, J = 8.0 Hz, 1H), 7.64 (td, J = 7.8, 1.7 Hz, 1H), 7.15 — 7.13 (m, 1H), 4.01 (s, 3H), 3.99 (s, 3H). SC NMR (126 MHz, CDCIs) 5 168.1, 164.9, 159.8, 151.7, 149.5, 136.1, 123.8, 122.1, 114.5, 54.9, 54.1. The characterization data matched those previously reported.""! N,N-Dimethyl1-5-(pyridin-2-yl)pyrimidin-2-amine (3u) (Scheme 2) S18"	Paper10_SI	18	299	160	2265	3034
325	-1	Suzuki-Miyaura Cross-Coupling of 2-Pyridyl Ammonium Salts by N—C Activation Hu et al. |_- NONG te (OF)2 tpaiPr(cin)Cl], Cs2CO3 | 20 Au H2O, Dioxane, 80 °C, 8h Tf MeoN According to the general procedure, the reaction of N,N,N-trimethylpyridin-2-aminium trifluoromethanesulfonate (0.20 mmol, 1.0 equiv), (2-(dimethylamino)pyrimidin-5-yl)boronic acid (2.0 equiv), Cs2CO3 (2.0 equiv), water (5.0 equiv), and [Pd(IPr)(cin)Cl] (10 mol%) in dioxane (0.20 M) for 8 h at 80 °C, afforded after filtration and chromatography on silica gel (EtOAc/petroleum ether = 1:4) the title compound in 56% yield (22.6 mg). White solid. 'H NMR (500 MHz, CDCls) 6 8.90 (s, 2H), 8.58 (dd, J = 4.8, 0.7 Hz, 1H), 7.63 (td, J = 7.9, 1.8 Hz, 1H), 7.50 (d, J = 8.0 Hz, 1H), 7.12 — 7.09 (m, 1H), 3.20 (s, 6H). '3C NMR (126 MHz, CDCl) 8 162.0, 156.1, 153.7, 149.8, 136.7, 121.5, 120.3, 118.4, 37.2. HRMS Calcd for CiiHi3N4 [M+H]*: 201.1135, found: 201.1134. tert-Butyl 2-(pyridin-2-yl)-1H-pyrrole-1-carboxylate (3v) (Scheme 2) O wat by [Pd(IPr)(cin)Cl], Cs9CO3 (Tin H,0O, Dioxane, 80 °C, &h CT | ~_ According to the general procedure, the reaction of N,N,N-trimethylpyridin-2-aminium trifluoromethanesulfonate (0.20 mmol, 1.0 equiv), (1-(tert-butoxycarbony]l)-1H-pyrrol-2- yl)boronic acid (3.0 equiv), Cs2CO3 (2.0 equiv), water (5.0 equiv), and [Pd(IPr)(cin)Cl] (10 mol%) in dioxane (0.20 M) for 8 h at 80 °C, afforded after filtration and chromatography on silica gel (EtOAc/petroleum ether = 1:4) the title compound in 43% yield (21.2 mg). Brown oil. 'H NMR (500 MHz, CDCls) 8 8.60 (d, J = 4.2 Hz, 1H), 7.66 (td, J = 7.7, 1.6 Hz, 1H), 7.39 — 7.36 (m, 2H), 7.19 — 7.16 (m, 1H), 6.41 (dd, J = 3.1, 1.6 Hz, 1H), 6.23 (t, J = 3.2 Hz, 1H), 1.34 (s, 9H). °C NMR (126 MHz, CDCls) & 152.9, 149.3, 148.8, 135.8, 134.1, 123.5, 123.5, 121.8, 115.6, 110.6, 83.6, 27.6. The characterization data matched those previously reported.’ 2-(1-Methyl-1H-pyrazol-4-yl)pyridine (3w) (Scheme 2) S19	Paper10_SI	19	299	160	2260	3034
326	-1	Suzuki-Miyaura Cross-Coupling of 2-Pyridyl Ammonium Salts by N—C Activation Hu et al. | B(OH . Nw UNS 1 Me-N (OH)2 [Pd(IPr)(cin)Cl], Cs,CO3 | Z. OTf N= HO, Dioxane, 80 °C, 8h 1a 2w According to the general procedure, the reaction of N,N,N-trimethylpyridin-2-aminium trifluoromethanesulfonate (0.20 mmol, 1.0 equiv), (1-methyl-1H-pyrazol-4-yl)boronic acid (3.0 equiv), Cs2CO3 (2.0 equiv), water (5.0 equiv), and [Pd(IPr)(cin)Cl] (10 mol%) in dioxane (0.20 M) for 8 h at 80 °C, afforded after filtration and chromatography on silica gel (EtOAc/petroleum ether = 1:4) the title compound in 46% yield (14.8 mg). Yellow oil. 'H NMR (500 MHz, CDCls) 6 8.46 (d, J = 4.2 Hz, 1H), 7.89 (s, 1H), 7.84 (s, 1H), 7.54 (td, J = 7.8, 1.6 Hz, 1H), 7.35 (d, J = 7.9 Hz, 1H), 6.99 (dd, J = 6.8, 5.4 Hz, 1H), 3.83 (s, 3H). °C NMR (126 MHz, CDCl) 5 151.8, 149.5, 137.4, 136.6, 128.8, 123.5, 121.0, 119.4, 39.1. The characterization data matched those previously reported.!” 3,5-Dimethyl-4-(pyridin-2-yl)isoxazole (3x) (Scheme 2) Me |_- B(OH . NON, ie 2 [Pa(IPr)(cin)Cl], Cs.CO; O \ H,O, Dioxane, 80 °C, 8h Tf N Me 2 1a 2x According to the general procedure, the reaction of N,N,N-trimethylpyridin-2-aminium trifluoromethanesulfonate (0.20 mmol, 1.0 equiv), (3,5-dimethylisoxazol-4-yl)boronic acid (2.0 equiv), Cs2CO3 (2.0 equiv), water (5.0 equiv), and [Pd(IPr)(cin)Cl] (10 mol%) in dioxane (0.20 M) for 8 h at 80 °C, afforded after filtration and chromatography on silica gel (EtOAc/petroleum ether = 1:4) the title compound in 60% yield (20.9 mg). Yellow oil. 'H NMR (500 MHz, CDCls) 6 8.63 (d, J = 4.0 Hz, 1H), 7.71 (td, J = 7.8, 1.8 Hz, 1H), 7.29 (d, J = 7.9 Hz, 1H), 7.20 — 7.17 (m, 1H), 2.52 (s, 3H), 2.38 (s, 3H). SC NMR (126 MHz, CDCl) 8 167.3, 158.7, 150.7, 149.9, 136.6, 122.9, 121.8, 116.1, 12.3, 11.5. The characterization data matched those previously reported.” 2-(Benzo[b ]thiophen-2-yl)pyridine (3y) (Scheme 2) S20	Paper10_SI	20	300	160	2261	3034
327	-1	Suzuki-Miyaura Cross-Coupling of 2-Pyridyl Ammonium Salts by N—C Activation Hu et al. /\ OH)> . S : B [Pd(IPr)(cin)Cl], Cs,CO3 Tf H2O, Dioxane, 80 °C, 8h 1a 2y } O1 +Zz— According to the general procedure, the reaction of N,N,N-trimethylpyridin-2-aminium trifluoromethanesulfonate (0.20 mmol, 1.0 equiv), benzo[b]thiophen-2-ylboronic acid (2.0 equiv), Cs2CO3 (2.0 equiv), water (5.0 equiv), and [Pd(IPr)(cin)Cl] (10 mol%) in dioxane (0.20 M) for 8 h at 80 °C, afforded after filtration and chromatography on silica gel (EtOAc/petroleum ether = 1:4) the title compound in 54% yield (23.0 mg). White solid. 'H NMR (500 MHz, CDCIs) 8 8.59 (d, J = 4.0 Hz, 1H), 7.85 — 7.83 (m, 1H), 7.75 (d, J = 10.1 Hz, 2H), 7.71 (d, J = 7.9 Hz, 1H), 7.63 (t, J = 7.1 Hz, 1H), 7.32 — 7.31 (m, 2H), 7.14 — 7.12 (m, 1H). °C NMR (126 MHz, CDCls) 5 152.5, 149.7, 144.9, 140.7, 140.5, 136.7, 125.1, 124.6, 124.2, 122.7, 122.7, 121.2, 119.6. The characterization data matched those previously reported.’ 2-(Benzo[b |thiophen-3-yl)pyridine (3z) (Scheme 2) | - | : NONG B(OH), _[Pd(IPr)(cin)CI], CsyCOs : Nw 2 ott . | HO, Dioxane, 80 °C, 8h Zz 1a 2z 3z According to the general procedure, the reaction of N,N,N-trimethylpyridin-2-aminium trifluoromethanesulfonate (0.20 mmol, 1.0 equiv), benzo[b]thiophen-3-ylboronic acid (2.0 equiv), Cs2CO3 (2.0 equiv), water (5.0 equiv), and [Pd(IPr)(cin)Cl] (10 mol%) in dioxane (0.20 M) for 8 h at 80 °C, afforded after filtration and chromatography on silica gel (EtOAc/petroleum ether = 1:4) the title compound in 65% yield (27.4 mg). White solid. 'H NMR (500 MHz, CDCIs) 8 8.69 (d, J = 3.9 Hz, 1H), 8.47 (d, J = 8.1 Hz, 1H), 7.85 (d, J = 8.0 Hz, 1H), 7.72 (s, 1H), 7.63 (td, J = 7.7, 1.6 Hz, 1H), 7.56 (d, J = 7.8 Hz, 1H), 7.41 (t, J= 7.4 Hz, 1H), 7.34 (t, J= 7.3 Hz, 1H), 7.15 (dd, J = 6.4, 5.2 Hz, 1H). °C NMR (126 MHz, CDCls) 5 154.6, 149.7, 140.9, 137.3, 136.7, 126.5, 124.8, 124.7, 124.3, 122.8, 122.7, 122.1. The characterization data matched those previously reported.’ 2-(Benzofuran-2-yl)pyridine (3aa) (Scheme 2) $21	Paper10_SI	21	300	160	2260	3034
328	-1	Suzuki-Miyaura Cross-Coupling of 2-Pyridyl Ammonium Salts by N—C Activation Hu et al. /\ OH)> . O , B( [Pd(IPr)(cin)Cl], Cs,CO3 Tf H20, Dioxane, 80 °C, 8h 1a 2aa 3aa } O1 +Z— According to the general procedure, the reaction of N,N,N-trimethylpyridin-2-aminium trifluoromethanesulfonate (0.20 mmol, 1.0 equiv), benzofuran-2-ylboronic acid (2.0 equiv), Cs2CO3 (2.0 equiv), water (5.0 equiv), and [Pd(IPr)(cin)Cl] (10 mol%) in dioxane (0.20 M) for 8 h at 80 °C, afforded after filtration and chromatography on silica gel (EtOAc/petroleum ether = 1:4) the title compound in 73% yield (28.5 mg). White solid. 'H NMR (500 MHz, CDCIs) 6 8.61 (d, J = 4.0 Hz, 1H), 7.78 (d, J = 7.9 Hz, 1H), 7.62 — 7.58 (m, 2H), 7.53 (d, J = 8.1 Hz, 1H), 7.38 (s, 1H), 7.29 (dd, J = 11.2, 4.0 Hz, 1H), 7.21 (t, J = 7.2 Hz, 1H), 7.10 (dd, J = 6.5, 5.0 Hz, 1H). C NMR (126 MHz, CDCl) 6 155.3, 155.1, 149.9, 149.2, 136.7, 128.9, 125.3, 123.3, 122.9, 121.7, 119.8, 111.6, 104.8. The characterization data matched those previously reported.’ 2-(Benzofuran-3-yl)pyridine (3ab) (Scheme 2) O | - : No NO . B(OH), [Pd(IPr)(cin)Cl], Cs.CO3 i Nw 2 on 5 | HO, Dioxane, 80 °C, 8h Zz 1a 2ab 3ab According to the general procedure, the reaction of N,N,N-trimethylpyridin-2-aminium trifluoromethanesulfonate (0.20 mmol, 1.0 equiv), benzofuran-3-ylboronic acid (2.0 equiv), Cs2CO3 (2.0 equiv), water (5.0 equiv), and [Pd(IPr)(cin)Cl] (10 mol%) in dioxane (0.20 M) for 8 h at 80 °C, afforded after filtration and chromatography on silica gel (EtOAc/petroleum ether = 1:4) the title compound in 57% yield (22.4 mg). Yellow solid. 'H NMR (500 MHz, CDCIs) 6 8.66 (d, J = 4.8 Hz, 1H), 8.26 — 8.23 (m, 1H), 8.11 (s, 1H), 7.63 — 7.56 (m, 2H), 7.53 — 7.50 (m, 1H), 7.33 — 7.30 (m, 2H), 7.12 — 7.09 (m, 1H). °C NMR (126 MHz, CDCls) & 156.1, 152.3, 149.9, 144.0, 136.5, 125.7, 124.8, 123.4, 122.1, 122.0, 121.8, 121.0, 111.7. The characterization data matched those previously reported.!? 3-(Pyridin-2-yl)quinoline (3ac) (Scheme 2) $22	Paper10_SI	22	301	160	2250	3034
329	-1	Suzuki-Miyaura Cross-Coupling of 2-Pyridyl Ammonium Salts by N—C Activation Hu et al. | - NG loos (OM)2 — IpaiPr)(cin)Cl], Cs2CO3 Cy (Ton HO, Dioxane, 80 °C, 8h According to the general procedure, the reaction of N,N,N-trimethylpyridin-2-aminium 3ac trifluoromethanesulfonate (0.20 mmol, 1.0 equiv), quinolin-3-ylboronic acid (2.0 equiv), Cs2CO3 (2.0 equiv), water (5.0 equiv), and [Pd(IPr)(cin)Cl] (10 mol%) in dioxane (0.20 M) for 8 h at 80 °C, afforded after filtration and chromatography on silica gel (EtOAc/petroleum ether = 1:4) the title compound in 68% yield (28.2 mg). White solid. 'H NMR (500 MHz, CDCls) 9.54 (d, J = 1.6 Hz, 1H), 8.74 (d, J = 4.6 Hz, 1H), 8.71 (d, J = 1.3 Hz, 1H), 8.14 (d, J = 8.5 Hz, 1H), 7.88 (d, J = 8.1 Hz, 1H), 7.83 (d, J = 7.9 Hz, 1H), 7.78 — 7.75 (m, 1H), 7.71 (t, J = 7.6 Hz, 1H), 7.54 (t, J = 7.5 Hz, 1H), 7.26 (dd, J = 6.9, 5.3 Hz, 1H). °C NMR (126 MHz, CDCls) 8 154.7, 150.1, 149.3, 148.2, 137.0, 133.8, 131.8, 129.9, 129.2, 128.5, 127.8, 127.0, 122.8, 120.8. The characterization data matched those previously reported. '4 2-(Dibenzo[b,d]furan-4-yl)pyridine (3ad) (Scheme 2) < 4s NS [Pd(IPr)(cin)Cl], Cs:COg | cs NN B(OH), 2 OTt (> HO, Dioxane, 80 °C, 8h 1a 2ad 3ad According to the general procedure, the reaction of N,N,N-trimethylpyridin-2-aminium trifluoromethanesulfonate (0.20 mmol, 1.0 equiv), dibenzo[b,d]furan-4-ylboronic acid (2.0 equiv), Cs2CO3 (2.0 equiv), water (5.0 equiv), and [Pd(IPr)(cin)Cl] (10 mol%) in dioxane (0.20 M) for 8 h at 80 °C, afforded after filtration and chromatography on silica gel (EtOAc/petroleum ether = 1:4) the title compound in 74% yield (36.5 mg). White solid. 'H NMR (500 MHz, CDCl) 6 8.73 (d, J = 4.4 Hz, 1H), 8.31 (d, J = 8.0 Hz, 1H), 8.27 (d, J = 7.7 Hz, 1H), 7.86 — 7.83 (m, 2H), 7.70 (td, J = 7.8, 1.7 Hz, 1H), 7.53 (d, J = 8.2 Hz, 1H), 7.41 — 7.35 (m, 2H), 7.25 (t, J = 7.5 Hz, 1H), 7.16 — 7.13 (m, 1H). °C NMR (126 MHz, CDCl3) 5 156.1, 153.7, 153.7, 149.8, 136.6, 127.3, 125.2, 124.3, 124.2, 124.0, 123.3, 123.0, 122.5, 121.3, 120.7, 111.8. The characterization data matched those previously reported.!> $23	Paper10_SI	23	300	160	2265	3034
330	-1	Suzuki-Miyaura Cross-Coupling of 2-Pyridyl Ammonium Salts by N—C Activation Hu et al. 2'-Methoxy-6-methyl-2,3'-bipyridine (3ae) (Scheme 3) _~ |_- Mes NNN, (rt [Pd(IPr)(cin)Cl], CsgCO3 Me Nv | oN Un NZ OMe H,O, Dioxane, 80 °C, 8h | Z OMe 1b 2r 3ae According to the general procedure, the reaction of N,N,N,6-tetramethylpyridin-2-aminium trifluoromethanesulfonate (0.20 mmol, 1.0 equiv), (2-methoxypyridin-3-yl)boronic acid (2.0 equiv), Cs2CO3 (2.0 equiv), water (5.0 equiv), and [Pd(IPr)(cin)Cl] (10 mol%) in dioxane (0.20 M) for 8 h at 80 °C, afforded after filtration and chromatography on silica gel (EtOAc/petroleum ether = 1:4) the title compound in 68% yield (27.1 mg). Yellow solid. 'H NMR (500 MHz, CDCls3) 6 8.20 (dd, J = 7.4, 0.9 Hz, 1H), 8.17 (d, J = 4.9 Hz, 1H), 7.73 (d, J = 7.9 Hz, 1H), 7.55 (t, J = 7.7 Hz, 1H), 7.03 (d, J = 7.6 Hz, 1H), 6.98 (dd, J = 7.2, 5.1 Hz, 1H), 3.99 (s, 3H), 2.58 (s, 3H). °C NMR (126 MHz, CDCls) 8 161.1, 158.1, 153.4, 146.7, 139.4, 136.1, 123.3, 121.7, 121.6, 117.3, 53.4, 24.6. The characterization data matched those previously reported. '° 2'-Methoxy-4-methyl-2,3'-bipyridine (3af) (Scheme 3) N i= (Vo ~~ B(OH)2 — pa(iPr)(cin)Cl], Cs>CO3 7 oTf NZ Some 120, Dioxane, 80°C, 8h Me 1c 2r According to the general procedure, the reaction of N,N,N,4-tetramethylpyridin-2-aminium trifluoromethanesulfonate (0.20 mmol, 1.0 equiv), (2-methoxypyridin-3-yl)boronic acid (2.0 equiv), Cs2CO3 (2.0 equiv), water (5.0 equiv), and [Pd(IPr)(cin)Cl] (10 mol%) in dioxane (0.20 M) for 8 h at 80 °C, afforded after filtration and chromatography on silica gel (EtOAc/petroleum ether = 1:4) the title compound in 69% yield (27.7 mg). White solid. 'H NMR (500 MHz, CDCls) 6 8.52 (d, J =5.0 Hz, 1H), 8.16 (ddd, J = 9.3, 6.2, 1.9 Hz, 2H), 7.72 (s, 1H), 7.01 — 6.97 (m, 2H), 4.00 (s, 3H), 2.35 (s, 3H). °C NMR (126 MHz, CDCI3) 5 160.9, 153.9, 149.2, 147.0, 146.8, 139.5, 125.4, 123.2, 123.1, 117.3, 53.5, 21.2. HRMS Calcd for Ci2H13N20 [M+H]*: 201.1022, found: 201.1017. $24	Paper10_SI	24	301	160	2265	3034
331	-1	Suzuki-Miyaura Cross-Coupling of 2-Pyridyl Ammonium Salts by N—C Activation Hu et al. 2',4-Dimethoxy-2,3'-bipyridine (3ag) (Scheme 3) S N NC en yo. B(OM)2 pauiPrycinycil,CsxCOs SY Z OTE Zz . 5 Z OMe N OMe H,O, Dioxane, 80 °C, 8h OMe OMe 1d 2r 3ag According to the general procedure, the reaction of 4-methoxy-N,N,N-trimethylpyridin-2- aminium trifluoromethanesulfonate (0.20 mmol, 1.0 equiv), (2-methoxypyridin-3-yl)boronic acid (2.0 equiv), Cs2CO3 (2.0 equiv), water (5.0 equiv), and [Pd(IPr)(cin)Cl] (10 mol%) in dioxane (0.20 M) for 8 h at 80 °C, afforded after filtration and chromatography on silica gel (EtOAc/petroleum ether = 1:4) the title compound in 75% yield (32.3 mg). White solid. 'H NMR (500 MHz, CDCls) 6 8.51 (d, J = 5.7 Hz, 1H), 8.23 — 8.20 (m, 2H), 7.52 (d, J = 2.3 Hz, 1H), 7.02 (dd, J = 7.3, 5.0 Hz, 1H), 6.76 (dd, J = 5.7, 2.4 Hz, 1H), 4.03 (s, 3H), 3.86 (s, 3H). °C NMR (126 MHz, CDCls) 6 165.7, 160.9, 155.5, 150.5, 146.9, 139.5, 122.8, 117.3, 111.0, 108.2, 55.1, 53.6. The characterization data matched those previously reported.!7 2'-Methoxy-4-(trifluoromethyl)-2,3'-bipyridine (3ah) (Scheme 3) | S NOONG B(OH) ny. on | Ji. fs 2 [Pa(IPricin)Cl, Cs:CO3_ FS 7 of N~ ~oMe H20, Dioxane, 80 °C, 8h Z~ OMe CF; I 3 te 2r 3ah According to the general procedure, the reaction of N,N,N-trimethyl-4-(trifluoromethyl)pyridin- 2-aminium trifluoromethanesulfonate (0.20 mmol, 1.0 equiv), (2-methoxypyridin-3-yl)boronic acid (2.0 equiv), Cs2CO3 (2.0 equiv), water (5.0 equiv), and [Pd(IPr)(cin)Cl] (10 mol%) in dioxane (0.20 M) for 8 h at 80 °C, afforded after filtration and chromatography on silica gel (EtOAc/petroleum ether = 1:4) the title compound in 80% yield (40.5 mg). Yellow solid. 'H NMR (500 MHz, CDCls3) 6 8.82 (d, J = 5.0 Hz, 1H), 8.32 (dd, J = 7.5, 1.7 Hz, 1H), 8.29 (s, 1H), 8.24 (dd, J = 4.8, 1.7 Hz, 1H), 7.41 (d, J = 5.0 Hz, 1H), 7.03 (dd, J = 7.4, 4.9 Hz, 1H), 4.06 (s, 3H). '3C NMR (126 MHz, CDCl) 8 161.0, 155.3, 150.2, 147.8, 139.5, 138.3 (q, J = 33.8 Hz), 123.0 (q, J = 273.1 Hz), 121.4, 120.1 (q, J = 3.7 Hz), 117.5 (q, J = 3.4 Hz), 117.4, 53.6. °F NMR S25	Paper10_SI	25	301	160	2250	3034
332	-1	Suzuki-Miyaura Cross-Coupling of 2-Pyridyl Ammonium Salts by N—C Activation Hu et al. (471 MHz, CDClz) 5 -64.84. HRMS Calcd for Ci2HioF3N20 [M+H]*: 255.0740, found: 255.0738. 5-Fluoro-2'-methoxy-2,3'-bipyridine (3ai) (Scheme 3) N i N | | ST on * (lo (OF)2 [Pd(IPr)(cin)Cl], Cs2CO3 | S Z F x OTF H2O, Dioxane, 80°C,8h fF ZA OMe According to the general procedure, the reaction of 5-fluoro-N, WN, N-trimethylpyridin-2-aminium trifluoromethanesulfonate (0.20 mmol, 1.0 equiv), (2-methoxypyridin-3-yl)boronic acid (2.0 equiv), Cs2CO3 (2.0 equiv), water (5.0 equiv), and [Pd(IPr)(cin)Cl] (10 mol%) in dioxane (0.20 M) for 8 h at 80 °C, afforded after filtration and chromatography on silica gel (EtOAc/petroleum ether = 1:4) the title compound in 85% yield (34.6 mg). White solid. 'H NMR (500 MHz, CDCls) 6 8.50 (d, J = 2.8 Hz, 1H), 8.19 (t, J = 6.4 Hz, 2H), 7.98 (dd, J = 8.8, 4.5 Hz, 1H), 7.38 (td, J = 8.5, 2.9 Hz, 1H), 6.98 (dd, J = 7.3, 5.0 Hz, 1H), 4.00 (s, 3H). '3C NMR (126 MHz, CDCls) 5 160.8, 158.5 (d, J = 256.7 Hz), 150.1 (d, J = 4.0 Hz), 146.9, 139.2, 137.6 (d, J = 23.6 Hz), 125.3 (d, J = 4.2 Hz), 122.6 (d, J = 18.2 Hz), 121.9, 117.3, 53.5. °F NMR (471 MHz, CDCls) 6 - 128.94. HRMS Calcd for C1;Hio0FN20 [M+H]*: 205.0772, found: 205.0778. 2-Methoxy-5-(6-methylpyridin-2-yl)pyrimidine (3aj) (Scheme 3) x ar B(OH)2 — Ipa(ipr)(cin)Cl], Cs,.CO; Me S26	Paper10_SI	26	301	160	2265	3034
333	-1	""" 3ai Un, ’y Ad HO, Dioxane, 80 °C, 8h 1b 3aj"	Paper10_SI	26	418	914	1982	2332
334	-1	According to the general procedure, the reaction of N,N,N,6-tetramethylpyridin-2-aminium trifluoromethanesulfonate (0.20 mmol, 1.0 equiv), (2-methoxypyrimidin-5-yl)boronic acid (2.0 equiv), Cs2CO3 (2.0 equiv), water (5.0 equiv), and [Pd(IPr)(cin)Cl] (10 mol%) in dioxane (0.20 M) for 8 h at 80 °C, afforded after filtration and chromatography on silica gel (EtOAc/petroleum ether = 1:4) the title compound in 55% yield (22.3 mg). White solid. 'H NMR (500 MHz, CDCls) 5 9.06 (s, 2H), 7.61 (dd, J = 9.5, 5.9 Hz, 1H), 7.41 (d, J = 7.7 Hz, 1H), 7.09 (d, J = 7.5 Hz, 1H),	Paper10_SI	26	301	2385	2265	2860
335	-1	Suzuki-Miyaura Cross-Coupling of 2-Pyridyl Ammonium Salts by N—C Activation Hu et al. 4.04 (s, 3H), 2.57 (s, 3H). °C NMR (126 MHz, CDCls) 5 165.7, 159.0, 157.7, 151.6, 137.2, 126.8, 122.3, 116.6, 55.1, 24.6. The characterization data matched those previously reported. !® 2-Methoxy-5-(4-methylpyridin-2-yl)pyrimidine (3ak) (Scheme 3) N 2 ; Ti 4 1 B(OM)2 — [pa(IPr)(cin)Cl], Cs2CO; A | Z OTT : ° eo NZ HO, Dioxane, 80 °C, 8h Me 1c 2s According to the general procedure, the reaction of N,N,N,4-tetramethylpyridin-2-aminium trifluoromethanesulfonate (0.20 mmol, 1.0 equiv), (2-methoxypyrimidin-5-yl)boronic acid (3.0 2-Methoxy-5-(4-methoxypyridin-2-yl)pyrimidine (3al) (Scheme 3) N (7 ro ~ ry [Pd(IPr)(cin)Cl], Cs9CO3 a | Z OfTf Zz i ° eo oN H2O, Dioxane, 80 °C, 8h OMe 1d 2s According to the general procedure, the reaction of 4-methoxy-N,N,N-trimethylpyridin-2- aminium trifluoromethanesulfonate (0.20 mmol, 1.0 equiv), (2-methoxypyrimidin-5-yl)boronic acid (3.0 equiv), Cs2CO3 (3.0 equiv), water (5.0 equiv), and [Pd(IPr)(cin)Cl] (10 mol%) in dioxane (0.20 M) for 8 h at 80 °C, afforded after filtration and chromatography on silica gel (EtOAc/petroleum ether = 1:4) the title compound in 60% yield (26.2 mg). White solid. 'H NMR (500 MHz, CDCls) 5 9.04 (s, 2H), 8.47 (d, J = 5.7 Hz, 1H), 7.11 (d, J = 2.3 Hz, 1H), 6.77 (dd, J = 5.7, 2.4 Hz, 1H), 4.04 (s, 3H), 3.87 (s, 3H). °C NMR (126 MHz, CDCls) 5 166.5, 165.8, 157.7, $27	Paper10_SI	27	301	160	2261	3034
336	-1	equiv), Cs2CO3 (3.0 equiv), water (5.0 equiv), and [Pd(IPr)(cin)Cl] (10 mol%) in dioxane (0.20	Paper10_SI	27	301	1228	2249	1273
